Description,Price
15CM CHRISTMAS GLASS BALL 20 LIGHTS,6.95
PINK CHERRY LIGHTS,6.75
 WHITE CHERRY LIGHTS,6.75
RECORD FRAME 7" SINGLE SIZE ,2.1
STRAWBERRY CERAMIC TRINKET BOX,1.25
PINK DOUGHNUT TRINKET POT ,1.65
SAVE THE PLANET MUG,1.25
FANCY FONT HOME SWEET HOME DOORMAT,5.95
CAT BOWL ,2.55
"DOG BOWL , CHASING BALL DESIGN",3.75
HEART MEASURING SPOONS LARGE,1.65
LUNCHBOX WITH CUTLERY FAIRY CAKES ,2.55
DOOR MAT BLACK FLOCK ,5.95
LOVE BUILDING BLOCK WORD,5.45
HOME BUILDING BLOCK WORD,5.95
ASSORTED COLOUR BIRD ORNAMENT,1.69
 PEACE WOODEN BLOCK LETTERS,6.95
CHRISTMAS CRAFT WHITE FAIRY ,1.45
HEART IVORY TRELLIS LARGE,1.65
HEART FILIGREE DOVE LARGE,1.65
FULL ENGLISH BREAKFAST PLATE,3.39
PIZZA PLATE IN BOX,3.75
BLACK DINER WALL CLOCK,8.5
SET OF 3 BLACK FLYING DUCKS,4.65
AREA PATROLLED METAL SIGN,2.1
PLEASE ONE PERSON  METAL SIGN,2.1
BATH BUILDING BLOCK WORD,5.95
CLASSIC WHITE FRAME,2.95
SMALL MARSHMALLOWS PINK BOWL,1.25
BISCUITS SMALL BOWL LIGHT BLUE,1.25
SCOTTIE DOG HOT WATER BOTTLE,4.25
CHRISTMAS CRAFT HEART DECORATIONS,2.1
CHRISTMAS CRAFT HEART STOCKING ,2.1
PARTY CONE CHRISTMAS DECORATION ,0.85
PEACE SMALL WOOD LETTERS,6.75
JOY LARGE WOOD LETTERS,9.95
CINAMMON & ORANGE WREATH,6.75
EUCALYPTUS & PINECONE  WREATH,6.75
WOODEN BOX ADVENT CALENDAR ,8.95
FLORAL BLUE MONSTER,4.25
RETRO COFFEE MUGS ASSORTED,1.25
INFLATABLE POLITICAL GLOBE ,0.85
STRIPES DESIGN MONKEY DOLL,2.55
BLUE PADDED SOFT MOBILE,4.25
PACK OF 6 SKULL PAPER CUPS,0.65
PACK OF 20 SKULL PAPER NAPKINS,0.85
HANGING HEART ZINC T-LIGHT HOLDER,0.85
PINK BLUE FELT CRAFT TRINKET BOX,1.25
FELTCRAFT DOLL ROSIE,2.95
FELTCRAFT DOLL MARIA,2.95
FELTCRAFT DOLL EMILY,2.95
VINTAGE SNAKES & LADDERS,3.75
SCOTTIE DOG HOT WATER BOTTLE,4.95
CHOCOLATE HOT WATER BOTTLE,4.95
DINOSAURS  WRITING SET ,0.98
SET OF MEADOW  FLOWER STICKERS,1.69
CHARLIE AND LOLA CHARLOTTE BAG,1.15
JUMBO BAG CHARLIE AND LOLA TOYS,2
JUMBO BAG TOYS ,1.3
COUNTRY COTTAGE  DOORSTOP GREEN,2.5
GINGHAM HEART  DOORSTOP RED,2.5
CHARLIE+LOLA RED HOT WATER BOTTLE ,3
CHARLIE LOLA BLUE HOT WATER BOTTLE ,3
CHARLIE+LOLA PINK HOT WATER BOTTLE,1.9
CHARLIE + LOLA RED HOT WATER BOTTLE,1.9
TOMATO CHARLIE+LOLA COASTER SET,2.15
CARROT CHARLIE+LOLA COASTER SET,2.4
CHARLIE + LOLA BISCUITS TINS,6.38
CHARLIE AND LOLA FIGURES TINS,6.4
CHARLIE & LOLA WASTEPAPER BIN BLUE,2.4
CHARLIE & LOLA WASTEPAPER BIN FLORA,2.4
CHRISTMAS PUDDING TRINKET POT ,1.45
BAKING SET 9 PIECE RETROSPOT ,4.95
RETRO SPOT TEA SET CERAMIC 11 PC ,4.95
LUNCHBOX WITH CUTLERY RETROSPOT ,2.55
BLACK/BLUE DOTS RUFFLED UMBRELLA,5.95
RED/WHITE DOTS RUFFLED UMBRELLA,5.95
WRAP ENGLISH ROSE ,0.42
WRAP BLUE RUSSIAN FOLKART,0.42
SET OF THREE VINTAGE GIFT WRAPS,1.95
RETRO SPORT PARTY BAG + STICKER SET,1.65
ASSORTED CAKES FRIDGE MAGNETS,0.65
 VINTAGE DESIGN GIFT TAGS,0.85
PARTY CONE CHRISTMAS DECORATION ,0.85
PINK DOUGHNUT TRINKET POT ,1.65
RED TOADSTOOL LED NIGHT LIGHT,1.65
SET/3 RUSSIAN DOLL STACKING TINS,4.95
PACK 20 DOLLY PEGS,0.85
ASSORTED COLOUR MINI CASES,7.95
POSTAGE,18
CAT BOWL ,2.55
"DOG BOWL , CHASING BALL DESIGN",3.75
BIRD DECORATION RED SPOT,0.72
BAKING SET 9 PIECE RETROSPOT ,4.25
RED WOOLLY HOTTIE WHITE HEART.,2.95
SCOTTIE DOG HOT WATER BOTTLE,4.25
UNION JACK GUNS & ROSES  DOORMAT,6.75
SCOTTIE DOG HOT WATER BOTTLE,4.95
HEART IVORY TRELLIS LARGE,1.65
YELLOW + BROWN BEAR FELT PURSE KIT,1.25
FELTCRAFT DOLL ROSIE,2.95
FELTCRAFT DOLL MARIA,2.95
WHITE HANGING HEART T-LIGHT HOLDER,2.95
KINGS CHOICE SMALL TUBE MATCHES,1.65
KINGS CHOICE GIANT TUBE MATCHES,2.55
KINGS CHOICE CIGAR BOX MATCHES ,1.25
EMPIRE TISSUE BOX,1.25
"GREETING CARD, THE BLACK CAT",0.42
RAINY LADIES BIRTHDAY CARD,0.42
BANQUET BIRTHDAY  CARD  ,0.42
SPACE BOY BIRTHDAY CARD,0.42
RING OF ROSES BIRTHDAY CARD,0.42
BOTANICAL LAVENDER BIRTHDAY CARD,0.42
SET3 BOOK BOX GREEN GINGHAM FLOWER ,4.25
SET/3 RED GINGHAM ROSE STORAGE BOX,3.75
SET 12 RETRO WHITE CHALK STICKS,0.42
VINTAGE SNAP CARDS,0.85
BINGO SET,3.75
VICTORIAN SEWING KIT,1.25
RETRO RED SPOTTY WASHING UP GLOVES,2.1
SET/2 RED SPOTTY TEA TOWELS ,2.95
RECORD FRAME 7" SINGLE SIZE ,2.1
VINYL RECORD FRAME SILVER,3.39
BATHROOM METAL SIGN,0.55
LADIES & GENTLEMEN METAL SIGN,2.55
RED SPOTTY OVEN GLOVE DOUBLE,2.95
POSTAGE,141
PINK FELT HANGING HEART W FLOWER,0.85
BLUE FELT HANGING HEART W FLOWER,0.85
BIRD DECORATION RED SPOT,0.85
PARTY CONE CHRISTMAS DECORATION ,0.85
RETRO SPOT LAMP,9.95
PARTY CONES CANDY ASSORTED,1.25
HEART STRING MEMO HOLDER HANGING,2.95
FOLKART BAUBLE CHRISTMAS DECORATION,0.38
6 CROCHET STRAWBERRIES,1.25
SET OF 72 PINK HEART PAPER DOILIES,1.45
LOVEBIRD HANGING DECORATION WHITE ,0.85
WHITE TALL PORCELAIN T-LIGHT HOLDER,2.55
BAKING SET 9 PIECE RETROSPOT ,4.95
EDWARDIAN TOILET ROLL UNIT ,12.75
SET/6 STRAWBERRY PAPER CUPS,0.65
SET/6 WOODLAND PAPER CUPS,0.65
JUMBO BAG PINK VINTAGE PAISLEY,1.95
"GARLAND , WOODEN  "" HAPPY EASTER""",1.25
SET/6 WOODLAND PAPER PLATES,0.85
RED HANGING HEART T-LIGHT HOLDER,2.55
WHITE HANGING HEART T-LIGHT HOLDER,2.55
VICTORIAN GLASS HANGING T-LIGHT,1.25
UNION JACK HOT WATER BOTTLE ,5.95
RED SPOT CERAMIC DRAWER KNOB,1.25
PAPER CHAIN KIT 50'S CHRISTMAS ,2.95
SCOTTIE DOG HOT WATER BOTTLE,4.95
CHOCOLATE HOT WATER BOTTLE,4.95
HEART FILIGREE DOVE  SMALL,1.25
FRYING PAN RED POLKADOT ,4.25
PAPER CHAIN KIT RETRO SPOT,2.95
HOT WATER BOTTLE TEA AND SYMPATHY,3.95
RED SPOT HEART HOT WATER BOTTLE,4.95
JUMBO BAG SCANDINAVIAN PAISLEY,1.95
JUMBO BAG PINK VINTAGE PAISLEY,1.95
JUMBO BAG RED WHITE SPOTTY ,1.95
"CHARLOTTE BAG , PINK/WHITE SPOTS",0.85
RED SPOTTY CHARLOTTE BAG,0.85
KINGS CHOICE CIGAR BOX MATCHES ,1.25
RETRO SPOT  CIGAR BOX MATCHES ,1.25
LUNCH BAG RED SPOTTY,1.65
LUNCH BAG CARS BLUE,1.65
LUNCH BAG WOODLAND,1.65
RETRO RED SPOTTY WASHING UP GLOVES,2.1
RED SPOTTY ROUND CAKE TINS,8.95
LARGE HEART MEASURING SPOONS,1.65
CREAM SWEETHEART MINI CHEST,12.75
POSTAGE,130
GOLD APERITIF GLASS,2.12
GOLD WINE GLASS,3.39
GOLD WINE GOBLET,4.25
SILVER APERITIF GLASS,2.12
PAPER BUNTING WHITE LACE,2.95
CREAM FELT EASTER EGG BASKET,1.65
POTTING SHED SOW 'N' GROW SET,4.25
POTTING SHED TWINE,2.1
PAPER CHAIN KIT RETRO SPOT,2.95
SAVE THE PLANET MUG,1.25
ANTIQUE SILVER TEA GLASS ETCHED,1.25
HANGING HEART ZINC T-LIGHT HOLDER,0.85
PAPER BUNTING RETRO SPOTS,2.95
PAPER BUNTING WHITE LACE,2.95
CREAM FELT EASTER EGG BASKET,1.65
POTTING SHED SOW 'N' GROW SET,4.25
POTTING SHED TWINE,2.1
PAPER CHAIN KIT RETRO SPOT,2.95
SAVE THE PLANET MUG,1.25
ANTIQUE SILVER TEA GLASS ETCHED,1.25
HANGING HEART ZINC T-LIGHT HOLDER,0.85
PAPER BUNTING RETRO SPOTS,2.95
PURPLE SWEETHEART BRACELET,4.25
PINK SWEETHEART BRACELET,4.25
BLACK SWEETHEART BRACELET,4.25
GREEN SWEETHEART BRACELET,4.25
BLUE SWEETHEART BRACELET,4.25
BLACK DIAMANTE EXPANDABLE RING,4.25
AMETHYST DIAMANTE EXPANDABLE RING,4.25
MIDNIGHT BLUE PAIR HEART HAIR SLIDE,3.75
CRYSTAL PAIR HEART HAIR SLIDES,3.75
ROSE COLOUR PAIR HEART HAIR SLIDES,3.75
PINK ENAMEL+GLASS HAIR COMB,2.1
PURPLE ENAMEL+GLASS HAIR COMB,2.1
DIAMANTE BOW BROOCH BLACK COLOUR,6.35
PINK CHERRY LIGHTS,6.75
PACK OF 60 PINK PAISLEY CAKE CASES,0.55
60 TEATIME FAIRY CAKE CASES,0.55
FELTCRAFT DOLL EMILY,2.95
FELTCRAFT DOLL MOLLY,2.95
SET 10 LIGHTS NIGHT OWL,6.75
BIRDS MOBILE VINTAGE DESIGN,5.95
3 PIECE JIGSAW TOADSTOOLS,1.65
BOYS ALPHABET IRON ON PATCHES,0.21
 WHITE CHERRY LIGHTS,6.75
BAKING SET 9 PIECE RETROSPOT ,4.95
RETRO SPOT TEA SET CERAMIC 11 PC ,4.95
 SILVER CHERRY LIGHTS,6.75
RED TOADSTOOL LED NIGHT LIGHT,1.65
GIRLS ALPHABET IRON ON PATCHES ,0.21
RED STRIPE CERAMIC DRAWER KNOB,1.25
BLUE STRIPE CERAMIC DRAWER KNOB,1.25
BLUE SPOT CERAMIC DRAWER KNOB,1.25
RED SPOT CERAMIC DRAWER KNOB,1.25
WHITE SPOT RED CERAMIC DRAWER KNOB,1.25
WHITE SPOT BLUE CERAMIC DRAWER KNOB,1.25
UNION JACK HOT WATER BOTTLE ,5.95
STRAWBERRY CERAMIC TRINKET BOX,1.25
BLUE CHARLIE+LOLA PERSONAL DOORSIGN,2.95
RED CHARLIE+LOLA PERSONAL DOORSIGN,2.95
KEEP OUT BOYS DOOR HANGER ,1.45
TOXIC AREA  DOOR HANGER ,1.45
DOOR HANGER  MUM + DADS ROOM,1.45
MOODY BOY  DOOR HANGER ,1.45
AREA PATROLLED METAL SIGN,2.1
PLEASE ONE PERSON  METAL SIGN,2.1
LADIES & GENTLEMEN METAL SIGN,2.55
WOODEN FRAME ANTIQUE WHITE ,2.95
WOOD S/3 CABINET ANT WHITE FINISH,7.95
WOOD 2 DRAWER CABINET WHITE FINISH,5.95
PINK SWEETHEART BRACELET,4.25
GREEN SWEETHEART BRACELET,4.25
PACK OF 72 RETRO SPOT CAKE CASES,0.55
60 TEATIME FAIRY CAKE CASES,0.55
RETRO SPOT LAMP,9.95
FAIRY CAKE CANDLES,1.49
CERAMIC BOWL WITH STRAWBERRY DESIGN,2.95
CERAMIC CAKE BOWL + HANGING CAKES,2.95
PURPLE SWEETHEART BRACELET,4.25
BLUE SWEETHEART BRACELET,4.25
BLACK SWEETHEART BRACELET,4.25
BLACK DIAMANTE EXPANDABLE RING,4.25
AMETHYST DIAMANTE EXPANDABLE RING,4.25
MIDNIGHT BLUE PAIR HEART HAIR SLIDE,3.75
CRYSTAL PAIR HEART HAIR SLIDES,3.75
ROSE COLOUR PAIR HEART HAIR SLIDES,3.75
PINK ENAMEL+GLASS HAIR COMB,2.1
PURPLE ENAMEL+GLASS HAIR COMB,2.1
DIAMANTE BOW BROOCH BLACK COLOUR,6.35
85123a mixed,0
"FOLDING UMBRELLA , BLACK/BLUE  SPOT",4.95
FOLDING UMBRELLA  PINK/WHITE  SPOT,4.95
FOLDING UMBRELLA  CREAM/MULTI  SPOT,4.95
"FOLDING UMBRELLA , RED/WHITE SPOT",4.95
FOLDING UMBRELLA  WHITE/RED  SPOT,4.95
PICCADILLY TEA SET,14.95
UNION JACK HOT WATER BOTTLE ,5.95
WHITE HANGING HEART T-LIGHT HOLDER,2.55
RED HANGING HEART T-LIGHT HOLDER,2.95
RETRO BLUE SPOTTY WASHING UP GLOVES,2.1
RETRO PINK SPOT WASHING UP GLOVES,2.1
RETRO RED SPOTTY WASHING UP GLOVES,2.1
FUNKY WASHING UP GLOVES ASSORTED,2.1
DOOR MAT FAIRY CAKE,6.75
HOT WATER BOTTLE TEA AND SYMPATHY,3.95
FAWN BLUE HOT WATER BOTTLE,2.95
ANTIQUE LILY FAIRY LIGHTS,4.25
VINTAGE CREAM 3 BASKET CAKE STAND,9.95
ASSORTED COLOUR BIRD ORNAMENT,1.45
short,0
21733 mixed,0
FELTCRAFT 6 FLOWER FRIENDS,2.1
CHARLIE LOLA BLUE HOT WATER BOTTLE ,4.65
CHARLIE+LOLA PINK HOT WATER BOTTLE,2.95
CHARLIE + LOLA RED HOT WATER BOTTLE,2.95
UNION JACK HOT WATER BOTTLE ,5.95
MUSHROOM BLUE HOT WATER BOTTLE,2.95
CHICK GREY HOT WATER BOTTLE,3.45
GREY FLORAL FELTCRAFT SHOULDER BAG,3.75
PINK FLORAL FELTCRAFT SHOULDER BAG,3.75
CHARLIE AND LOLA CHARLOTTE BAG,1.65
PINK CROCHET CAT WITH SCARF,4.25
PINK CREAM FELT CRAFT TRINKET BOX ,1.25
PINK BLUE FELT CRAFT TRINKET BOX,1.25
PINK JUMPER LARRY THE LAMB,2.1
UNION JACK HOT WATER BOTTLE ,5.95
SET OF THREE 50'S GIFT WRAPS ,1.95
PARTY INVITES JAZZ HEARTS,0.85
PARTY INVITES WOODLAND,0.85
PAPER CHAIN KIT 50'S CHRISTMAS ,2.95
PINK 3 PIECE MINI DOTS CUTLERY SET,3.75
BLUE 3 PIECE MINI DOTS CUTLERY SET,3.75
COFFEE MUG CAT + BIRD DESIGN,2.55
COFFEE MUG DOG + BALL DESIGN,2.55
 VINTAGE DESIGN GIFT TAGS,0.85
SWEETHEART CERAMIC TRINKET BOX,1.25
OPULENT VELVET CANDLE IN BOX,2.1
VINTAGE ROSE BEAD BRACELET BLUE,4.25
WHITE GLASS CHUNKY CHARM BRACELET,8.95
BLACK GEMSTONE BRACELET,8.95
CARNIVAL BRACELET,12.75
JUMBO STORAGE BAG SKULLS,1.95
DAIRY MAID CERAMIC BUTTER DISH,4.25
RETRO SPOT LARGE MILK JUG,4.95
KISS REINDEER SCANDINAVIAN STOCKING,2.55
LADYBIRD + BEE RAFFIA FOOD COVER,3.75
JUMBO BAG RED WHITE SPOTTY ,1.95
DOOR MAT FAIRY CAKE,5.95
TEA TIME PARTY BUNTING,4.65
JUMBO BAG PINK VINTAGE PAISLEY,1.95
RETRO SPOT TEA SET CERAMIC 11 PC ,4.95
PAPER CHAIN KIT 50'S CHRISTMAS ,2.95
WEEKEND BAG VINTAGE ROSE PAISLEY,8.5
BAKING SET 9 PIECE RETROSPOT ,4.95
WHITE SKULL HOT WATER BOTTLE ,3.75
VINTAGE HEADS AND TAILS CARD GAME ,1.06
CHARLIE+LOLA PINK HOT WATER BOTTLE,2.55
ANTIQUE LILY FAIRY LIGHTS,4.25
COLOUR GLASS. STAR T-LIGHT HOLDER,2.75
CERAMIC CAKE STAND + HANGING CAKES,8.5
MINI CAKE STAND WITH HANGING CAKES,1.25
UNION JACK GUNS & ROSES  DOORMAT,5.95
VICTORIAN SEWING BOX LARGE,10.95
SET/3 TALL GLASS CANDLE HOLDER PINK,3.95
PINK FAIRY CAKE CHILD'S APRON,1.65
PINK UNION JACK  LUGGAGE TAG,1.25
RED SPOTTY OVEN GLOVE DOUBLE,2.95
LAUNDRY 15C METAL SIGN,1.25
"AIRLINE LOUNGE,METAL SIGN",2.1
KEEP OUT BOYS DOOR HANGER ,1.45
METAL SIGN CUPCAKE SINGLE HOOK,1.25
NO JUNK MAIL METAL SIGN,1.25
PINK UNION JACK  PASSPORT COVER ,2.1
BLACK SIL'T SQU CANDLE PLATE ,2.1
WOODLAND CHARLOTTE BAG,0.85
POTTING SHED COFFEE MUG,1.25
POTTERING MUG,1.25
RETRO RED SPOTTY WASHING UP GLOVES,2.1
FAIRY SOAP SOAP HOLDER,1.69
UNION JACK FLAG PASSPORT COVER ,2.1
FLOWER VINE RAFFIA FOOD COVER,3.75
VINTAGE NOTEBOOK PARIS DAYS,2.95
SQUARE MIRROR CURTAIN,7.95
ENGLISH ROSE TEA SET IN GIFT BOX,4.65
GREEN 3 PIECE MINI DOTS CUTLERY SET,3.75
GREEN  SPOTTY PLATE ,1.69
GREEN SPOTTY CUP,0.85
BAG 500g SWIRLY MARBLES,1.65
VINTAGE SEASIDE JIGSAW PUZZLES,3.75
VINTAGE SNAKES & LADDERS,3.75
PINK STRAWBERRY HANDBAG ,2.95
GLITTER STAR GARLAND WITH BELLS ,3.75
WHITE HANGING HEART T-LIGHT HOLDER,2.95
HAIRCLIPS FORTIES FABRIC ASSORTED,0.65
PARTY CONE CHRISTMAS DECORATION ,0.85
RETRO SPOT SMALL TUBE MATCHES,1.65
PINK CREAM FELT CRAFT TRINKET BOX ,1.25
VINTAGE SNAKES & LADDERS,3.75
VINTAGE HEADS AND TAILS CARD GAME ,1.25
VINTAGE SNAP CARDS,0.85
JUMBO STORAGE BAG SUKI,1.95
JUMBO BAG TOYS ,1.95
CAROUSEL DES CHILD'S APRON,1.65
RED 3 PIECE MINI DOTS CUTLERY SET,3.75
GREEN 3 PIECE MINI DOTS CUTLERY SET,3.75
SET OF THREE VINTAGE GIFT WRAPS,1.95
SET OF 2 FANCY FONT TEA TOWELS,2.95
PINK BLUE FELT CRAFT TRINKET BOX,1.25
SET OF MEADOW  FLOWER STICKERS,2.95
PARTY CONE CHRISTMAS DECORATION ,0.85
HAIRCLIPS FORTIES FABRIC ASSORTED,0.65
VINTAGE SEASIDE JIGSAW PUZZLES,3.75
GLITTER STAR GARLAND WITH BELLS ,3.75
CROSS STITCH ALPHABET CUSHION COVER,5.95
S/4 PISTACHIO LOVEBIRD COASTERS,2.55
HEART DECORATION PAINTED ZINC ,0.65
S/4 PISTACHIO LOVEBIRD COASTERS,2.55
SET OF THREE VINTAGE GIFT WRAPS,1.95
VINTAGE HEADS AND TAILS CARD GAME ,1.25
VINTAGE SNAP CARDS,0.85
VINTAGE SNAKES & LADDERS,3.75
"WHITE PEARL BEADED HEART, SMALL",1.25
GINGHAM HEART DECORATION,2.95
BLUE  SPOTTY PLATE ,1.69
BLUE SPOTTY BOWL,1.25
SET/3 TALL GLASS CANDLE HOLDER PINK,12.75
15CM CHRISTMAS GLASS BALL 20 LIGHTS,7.95
BAKING SET 9 PIECE RETROSPOT ,4.95
PAPER CHAIN KIT 50'S CHRISTMAS ,2.95
WHITE HANGING HEART T-LIGHT HOLDER,2.55
FRAPPUCINO SCARF KNITTING KIT,2.95
WASH BAG VINTAGE ROSE PAISLEY,2.55
GREEN ROSE WASHBAG,3.75
BLUE/BROWN DOTS RUFFLED UMBRELLA,5.95
BLACK/BLUE DOTS RUFFLED UMBRELLA,5.95
RED/WHITE DOTS RUFFLED UMBRELLA,5.95
PINK/BROWN DOTS RUFFLED UMBRELLA,5.95
AGED GLASS SILVER T-LIGHT HOLDER,0.65
ANTIQUE SILVER TEA GLASS ETCHED,1.25
SILVER HANGING T-LIGHT HOLDER,1.65
SET OF THREE VINTAGE GIFT WRAPS,1.95
CHOCOLATE THIS WAY METAL SIGN,2.1
PLEASE ONE PERSON  METAL SIGN,2.1
WOOD 2 DRAWER CABINET WHITE FINISH,5.95
 SILVER CHERRY LIGHTS,6.75
MIRRORED WALL ART POPPIES,2.55
HAND OVER THE CHOCOLATE   SIGN ,2.1
PAINTED BIRD ASSORTED CHRISTMAS,1.69
12 PENCILS TALL TUBE POSY,0.85
12 PENCILS TALL TUBE SKULLS,0.85
LARGE HEART FLOWERS HOOK   ,1.25
VINTAGE SNAKES & LADDERS,3.75
2 DAISIES HAIR COMB,2.95
ANT WHITE WIRE HEART SPIRAL,3.95
 WHITE CHERRY LIGHTS,6.75
GREEN VINTAGE EARRINGS ,3.75
FILIGREE DIAMANTE EARRINGS,4.25
PINK VINTAGE VICTORIAN EARRINGS,2.95
BROWN VINTAGE VICTORIAN EARRINGS,2.95
SILVER HOOP EARRINGS WITH FLOWER,5.95
RASPBERRY ANT COPPER FLOWER NECKLAC,5.95
NEW BAROQUE B'FLY NECKLACE RED,8.5
FLOWER GLASS GARLAND NECKL.36"BLACK,7.95
OLD ROSE COMBO BEAD NECKLACE,2.95
PINK/AMETHYST/GOLD NECKLACE,6.95
5 STRAND GLASS NECKLACE CRYSTAL,6.35
PURPLE CURRENT CANDLE RING,0.75
WHITE CHOCOLATE SCENT CANDLE,1.25
HOT WATER BOTTLE TEA AND SYMPATHY,3.95
FOUR HOOK  WHITE LOVEBIRDS,2.1
FANCY FONT HOME SWEET HOME DOORMAT,6.75
DOOR MAT NEW ENGLAND,6.75
DOOR MAT GREEN PAISLEY ,6.75
GRAND CHOCOLATECANDLE,1.45
SET/3 DECOUPAGE STACKING TINS,4.95
GLITTER BUTTERFLY CLIPS,2.55
RIBBON REEL SPOTS DESIGN ,1.65
RIBBON REEL STRIPES DESIGN ,1.65
HOME BUILDING BLOCK WORD,5.95
SHOE SHINE BOX ,9.95
PARTY METAL SIGN ,1.45
PLEASE ONE PERSON  METAL SIGN,2.1
NO SINGING METAL SIGN,2.1
12 EGG HOUSE PAINTED WOOD,12.75
PINK HEART CANDY BUTTON CALCULATOR,2.55
PAPER BUNTING VINTAGE PAISLEY,2.95
SET/3 RED GINGHAM ROSE STORAGE BOX,3.75
SILVER MINI TAPE MEASURE ,0.85
PAINTED BIRD ASSORTED CHRISTMAS,1.69
ASSORTED SANTA CHRISTMAS DECORATION,0.85
PAPER CHAIN KIT RETRO SPOT,2.95
PAPER CHAIN KIT 50'S CHRISTMAS ,2.95
NOEL WOODEN BLOCK LETTERS ,5.95
RED SPOT HEART HOT WATER BOTTLE,4.95
ZINC METAL HEART DECORATION,1.25
SET OF 2 FANCY FONT TEA TOWELS,2.95
,0
SET 12 RETRO WHITE CHALK STICKS,0.42
VINTAGE CREAM 3 BASKET CAKE STAND,9.95
YELLOW RED FLOWER PIGGY BANK,4.65
WHITE SKULL HOT WATER BOTTLE ,3.75
COLOURING PENCILS BROWN TUBE,0.85
GREY HEART HOT WATER BOTTLE,3.45
CAMOUFLAGE EAR MUFF HEADPHONES,5.49
LOCAL CAFE MUG,2.1
SCOTTIE DOG HOT WATER BOTTLE,4.95
KNITTED UNION FLAG HOT WATER BOTTLE,3.75
HOT WATER BOTTLE TEA AND SYMPATHY,3.95
BLUE WHITE SCARF HOT WATER BOTTLE,3.95
GEISHA GIRL CHOPSTICKS SET/5,1.95
URBAN CHIC CHOPSTICKS SET/5,1.95
POTTING SHED TEA MUG,1.25
KINGS CHOICE MUG,1.25
POTTING SHED COFFEE MUG,1.25
EIGHT PIECE DINOSAUR SET,1.25
EIGHT PIECE CREEPY CRAWLIE SET,1.25
EIGHT PIECE SNAKE  SET,1.25
RATTLE SNAKE EGGS,1.25
DINOSAUR KEYRINGS ASSORTED,0.21
KINGS CHOICE SMALL TUBE MATCHES,1.65
RETRO SPOT SMALL TUBE MATCHES,1.65
ASSORTED TUTTI FRUTTI NOTEBOOK,2.1
WOODEN BOX ADVENT CALENDAR ,8.95
CAKE STAND LACE WHITE,4.25
CAKE PLATE LOVEBIRD WHITE,4.95
COFFEE MUG DOG + BALL DESIGN,2.55
COFFEE MUG CAT + BIRD DESIGN,2.55
COFFEE MUG PINK PAISLEY DESIGN,2.55
COFFEE MUG BLUE PAISLEY DESIGN,2.55
COFFEE MUG PEARS  DESIGN,2.55
COFFEE MUG APPLES DESIGN,2.55
PARTY CONES CARNIVAL ASSORTED,1.25
PARTY CONE CHRISTMAS DECORATION ,0.85
ANTIQUE GLASS HEART DECORATION ,1.95
ASSORTED TUTTI FRUTTI KEYRING,0.85
ANGEL DECORATION 3 BUTTONS ,0.42
STAR DECORATION RUSTIC,0.42
HEART FILIGREE DOVE  SMALL,1.25
PAINTED BIRD ASSORTED CHRISTMAS,1.69
WOODEN BOX OF DOMINOES,1.25
GREEN CHRISTMAS TREE STRING 20LIGHT,4.95
RED REINDEER STRING OF 20 LIGHTS,4.95
BINGO SET,3.75
COSY HOUR GIANT TUBE MATCHES,2.55
RETRO SPOT GIANT  TUBE MATCHES,2.55
KINGS CHOICE GIANT TUBE MATCHES,2.55
GLITTER CHRISTMAS HEART ,0.85
GLITTER CHRISTMAS STAR ,0.85
GLITTER CHRISTMAS TREE,0.85
DOOR MAT 3 SMILEY CATS,6.75
RED SPOTTY COIR DOORMAT,6.75
DOORMAT HEARTS,6.75
SKULLS WRAP,0.42
MINATURE COLOURED GARDENING SET,4.95
COLOURING PENCILS BROWN TUBE,1.25
UNION JACK HOT WATER BOTTLE ,5.95
GREEN BLUE FLOWER PIGGY BANK,4.65
PINK SPOTTY BOWL,1.25
RED SPOTTY BOWL,1.25
BLUE SPOTTY BOWL,1.25
SET/6 RED SPOTTY PAPER CUPS,0.65
SET OF 6 CAKE CHOPSTICKS,1.25
CAMOUFLAGE LED TORCH,1.69
CHOCOLATE CALCULATOR,1.65
200 RED + WHITE BENDY STRAWS,1.25
I CAN ONLY PLEASE ONE PERSON MUG,1.25
NO SINGING METAL SIGN,2.1
PLEASE ONE PERSON  METAL SIGN,2.1
METAL SIGN EMPIRE TEA,2.95
COOK WITH WINE METAL SIGN ,1.95
GIN + TONIC DIET METAL SIGN,2.1
POTTERING IN THE SHED METAL SIGN,1.95
CHOCOLATE THIS WAY METAL SIGN,2.1
AREA PATROLLED METAL SIGN,2.1
HAND OVER THE CHOCOLATE   SIGN ,2.1
LADIES & GENTLEMEN METAL SIGN,2.55
"POPCORN HOLDER , SMALL ",0.85
SET/6 RED SPOTTY PAPER PLATES,0.85
SET/6 CHRISTMAS ICICLE T-LIGHTS,1.25
MIRROR MOSAIC T-LIGHT HOLDER ROUND,1.65
WHITE WITH BLACK CATS MUG,0.85
PAINTED METAL PEARS ASSORTED,1.69
LOVE BUILDING BLOCK WORD,5.95
ASSORTED COLOUR BIRD ORNAMENT,1.69
RED 3 PIECE MINI DOTS CUTLERY SET,3.75
PINK 3 PIECE MINI DOTS CUTLERY SET,3.75
BLUE 3 PIECE MINI DOTS CUTLERY SET,3.75
RED SPOTTY CUP,0.85
BLUE  SPOTTY CUP,0.85
PINK  SPOTTY CUP,0.85
MAGIC GARDEN MOUNT FUJI,2.55
MAGIC SHEEP WOOL GROWING FROM PAPER,2.55
6 RIBBONS RUSTIC CHARM,1.65
TRADITIONAL CHRISTMAS RIBBONS,1.25
SCANDINAVIAN REDS RIBBONS,1.25
6 RIBBONS ELEGANT CHRISTMAS ,1.65
6 RIBBONS EMPIRE  ,1.65
 WHITE CHERRY LIGHTS,6.75
LIGHT PINK CHERRY LIGHTS,6.75
BROWN FLOWER LIGHTS,6.75
WILLOW BRANCH LIGHTS.,6.75
ASSORTED COLOUR BIRD ORNAMENT,1.45
VICTORIAN SEWING BOX LARGE,12.75
BLUE PULL BACK RACING CAR,0.55
SET/6 3D KIT CARDS FOR KIDS,0.85
SCANDINAVIAN REDS RIBBONS,1.25
PACK OF 60 MUSHROOM CAKE CASES,0.55
RED SPOTS  WRAP ,0.42
6 RIBBONS RUSTIC CHARM,1.65
ANTIQUE SILVER TEA GLASS ETCHED,1.25
SILVER HANGING T-LIGHT HOLDER DOME,1.65
RETRO SPOTS PUDDING BOWL,4.25
RED HANGING HEART T-LIGHT HOLDER,2.95
WHITE HANGING HEART T-LIGHT HOLDER,2.95
RED SPOTTY SHOPPER BAG,1.25
RED SPOTTY OVEN GLOVE DOUBLE,2.95
LOO ROLL  METAL SIGN ,1.65
PINK JUICY FRUIT PHOTO FRAME,2.55
RETRO SPOTS BUTTER DISH,4.95
WRAP BLIZZARD,0.42
ZINC METAL HEART DECORATION,1.25
RETRO SPOT TRADITIONAL TEAPOT ,7.95
RETRO SPOT LARGE MILK JUG,4.95
RETRO SPOT SUGAR JAM BOWL,2.55
RETRO SPOT LAMP,9.95
RETRO SPORT PARTY BAG + STICKER SET,1.65
HAIRCLIPS FORTIES FABRIC ASSORTED,0.65
SET/3 RUSSIAN DOLL STACKING TINS,4.95
RED SPOTTY BOWL,1.25
SET/5 RED SPOTTY LID GLASS BOWLS,2.95
RED SPOTTY ROUND CAKE TINS,9.95
RED SPOTTY CUP,0.85
RED SPOTTY PLATE ,1.69
JIGSAW TOADSTOOLS 3 PIECE,1.65
RETRO SPOT SMALL MILK JUG,2.55
RETRO SPOT MUG,2.95
RETRO SPOT STORAGE JAR,3.75
TEA CUP AND SAUCER RETRO SPOT,3.75
BIRD DECORATION RED SPOT,0.85
EDWARDIAN PARASOL BLACK,5.95
EDWARDIAN PARASOL NATURAL,5.95
RED TOADSTOOL LED NIGHT LIGHT,1.65
FELT TOADSTOOL LARGE,1.25
FELT TOADSTOOL  SMALL,0.85
POLYESTER FILLER PAD 40x40cm,1.45
POLYESTER FILLER PAD 60x40cm,2.55
KIDS RAIN MAC BLUE,0.85
KIDS RAIN MAC PINK,0.85
RED SPOTTY CHILDS UMBRELLA,3.25
BLUE/BROWN DOTS RUFFLED UMBRELLA,5.95
ZINC WILLIE WINKIE  CANDLE STICK,0.85
POSTAGE,18
15CM CHRISTMAS GLASS BALL 20 LIGHTS,7.95
CREAM SWEETHEART MAGAZINE RACK,16.95
DOOR MAT TOPIARY,6.75
SET OF THREE VINTAGE GIFT WRAPS,1.95
SWALLOWS GREETING CARD,0.42
SET/20 POSIES PAPER NAPKINS,0.85
BLUE PAISLEY NOTEBOOK,1.65
BLUE PAISLEY JOURNAL ,2.55
PENNY FARTHING BIRTHDAY CARD,0.42
VIPPASSPORT COVER ,2.1
SET/10 PINK SPOTTY PARTY CANDLES,1.25
SET/10 BLUE SPOTTY PARTY CANDLES,1.25
TROPICAL LUGGAGE TAG,1.25
"WRAP, FRIENDSHIP ON GREEN",0.42
STRAWBERRIES PRINT BOWL,1.25
COFFEE MUG DOG + BALL DESIGN,2.55
PACK 20 ENGLISH ROSE PAPER NAPKINS,0.85
PAPER CHAIN KIT 50'S CHRISTMAS ,2.95
TROPICAL PASSPORT COVER ,2.1
UNION JACK FLAG PASSPORT COVER ,2.1
UNION JACK FLAG LUGGAGE TAG,1.25
VIP LUGGAGE TAG ,1.25
BLUE WHITE SCARF HOT WATER BOTTLE,3.95
PINK STRAWBERRY HANDBAG ,2.95
CHRYSANTHEMUM NOTEBOOK,1.65
GREEN FERN NOTEBOOK,1.65
SPACE BOY BIRTHDAY CARD,0.42
SWALLOWS GREETING CARD,0.42
RAINY LADIES BIRTHDAY CARD,0.42
ROBOT BIRTHDAY CARD,0.42
DINOSAUR BIRTHDAY CARD,0.42
PENNY FARTHING BIRTHDAY CARD,0.42
DINOSAUR BIRTHDAY CARD,0.42
CAMOUFLAGE LED TORCH,1.69
MULTI HEARTS  STICKERS,0.85
SKULLS  WATER TRANSFER TATTOOS ,0.85
ROSE DU SUD CHILDS APRON,4.25
12 PENCILS TALL TUBE POSY,0.85
12 PENCILS TALL TUBE SKULLS,0.85
PINK DRESS JEWELLERY STAND ,2.95
BLACK STITCHED WALL CLOCK,3.75
RED GINGHAM ROSE JEWELLERY BOX,1.65
F FAIRY POTPOURRI CUSHIONS LAVENDER,1.69
DOOR MAT TOPIARY,6.75
PINK SPOTS  WRAP ,0.42
GREEN GINGHAM FLOWER JEWELLERY BOX,1.65
VINTAGE SNAKES & LADDERS,3.75
PAPER CHAIN KIT 50'S CHRISTMAS ,2.95
KENSINGTON COFFEE SET,12.75
SET OF THREE 50'S GIFT WRAPS ,1.95
OCEAN SCENT CANDLE IN JEWELLED BOX,4.25
ROSE SCENT CANDLE JEWELLED DRAWER,4.25
GLASS HONEYPOT WASP CATCHER,1.95
COLOUR GLASS. STAR T-LIGHT HOLDER,3.25
ANTIQUE LILY FAIRY LIGHTS,4.95
WHITE HANGING HEART T-LIGHT HOLDER,2.95
KINGS CHOICE CIGAR BOX MATCHES ,1.25
COSY HOUR CIGAR BOX MATCHES ,1.25
KINGS CHOICE SMALL TUBE MATCHES,1.65
COSY HOUR GIANT TUBE MATCHES,2.55
WOOD S/3 CABINET ANT WHITE FINISH,7.95
WOOD 2 DRAWER CABINET WHITE FINISH,5.95
CHOCOLATE HOT WATER BOTTLE,4.95
SCOTTIE DOG HOT WATER BOTTLE,4.95
S/4 FESTIVE GREEN DINNER CANDLES,1.25
REX CASH+CARRY JUMBO SHOPPER,0.95
BRIGHT BLUES RIBBONS ,1.25
PACK OF 12 HEARTS DESIGN TISSUES ,0.29
PACK OF 12 RED SPOTTY TISSUES ,0.29
RECYCLED PENCIL WITH RABBIT ERASER,0.21
PAPER CHAIN KIT RETRO SPOT,2.95
PAPER CHAIN KIT 50'S CHRISTMAS ,2.95
SCOTTIE DOG HOT WATER BOTTLE,4.95
ROTATING SILVER ANGELS T-LIGHT HLDR,2.55
RED SPOT HEART HOT WATER BOTTLE,4.95
PACK OF 72 RETRO SPOT CAKE CASES,0.55
60 GOLD AND SILVER FAIRY CAKE CASES,0.55
STRAWBERRY SCENTED SET/9 T-LIGHTS,0.85
CINAMMON SET OF 9 T-LIGHTS,0.85
FROSTED BOX 9 WHITE T-LIGHT CANDLES,0.42
SMALL RETRO SPOT MUG IN BOX  WHITE,3.75
SMALL RETRO SPOT MUG IN BOX  RED,3.75
6 RIBBONS RUSTIC CHARM,1.65
SET/3 TALL GLASS CANDLE HOLDER PINK,12.75
ASSTD DESIGN BUBBLE GUM RING,0.21
ROMANTIC PINKS RIBBONS ,1.25
SILVER CHRISTMAS TREE BAUBLE STAND ,16.95
CORONA MEXICAN TRAY,3.75
MILK PAN RED RETROSPOT,3.75
SILVER SLEIGHBELL  WREATH,7.95
ANTIQUE SILVER TEA GLASS ETCHED,1.25
COFFEE MUG DOG + BALL DESIGN,2.55
RETRO SPOT SMALL MILK JUG,2.55
DAIRY MAID CERAMIC BUTTER DISH,4.25
DAIRY MAID  PUDDING BOWL,3.75
RETRO SPOT STORAGE JAR,3.75
DAIRY MAID LARGE MILK JUG,4.95
RETRO SPOT STORAGE JAR,3.75
RETRO SPOT LARGE MILK JUG,4.95
ANTIQUE SILVER TEA GLASS ETCHED,1.25
ZINC METAL HEART DECORATION,1.25
FRENCH ENAMEL CANDLEHOLDER,2.1
BATH BUILDING BLOCK WORD,5.95
JOY WOODEN BLOCK LETTERS,4.95
HOME BUILDING BLOCK WORD,5.95
HANGING HEART ZINC T-LIGHT HOLDER,0.85
JOY WOODEN BLOCK LETTERS,4.95
LOVE BUILDING BLOCK WORD,5.95
WOOLLY HAT SOCK GLOVE ADVENT STRING,5.95
Discount,9
Discount,19
LARGE CAMPHOR WOOD FIELD MUSHROOM ,5.45
FULL ENGLISH BREAKFAST PLATE,3.75
UNION JACK FLAG PASSPORT COVER ,2.1
DOOR MAT TOPIARY,6.75
RED STAR CARD HOLDER,2.95
ENGLISH ROSE GARDEN SECATEURS,1.95
ENGLISH ROSE TORCH,1.65
CHRISTMAS HANGING TREE WITH BELL,1.25
CHRISTMAS HANGING TREE WITH BELL,1.25
6 RIBBONS ELEGANT CHRISTMAS ,1.65
WHITE DOVE HONEYCOMB PAPER GARLAND,1.65
PAPER CHAIN KIT 50'S CHRISTMAS ,2.95
SET OF 12 LILY BOTANICAL T-LIGHTS,2.95
GREY HEART HOT WATER BOTTLE,3.45
PINK STRIPE HOT WATER BOTTLE,2.95
HEART FILIGREE DOVE LARGE,1.65
SET/6 IVORY BIRD T-LIGHT CANDLES,2.1
SET/6 SILVER REINDEER T-LIGHTS,1.95
SET/6 BLACK SNOWFLAKE T-LIGHTS ,1.69
SLATE TILE NATURAL HANGING,1.65
RAIN HAT WITH RED SPOTS,0.42
RETRO BLUE SPOTTY WASHING UP GLOVES,2.1
RETRO RED SPOTTY WASHING UP GLOVES,2.1
WISE MAN STAR SHAPE EGG PAN,1.65
PINK UNION JACK  PASSPORT COVER ,2.1
CHOCOLATE CALCULATOR,1.65
BLUE CHARLIE+LOLA PERSONAL DOORSIGN,2.95
RED CHARLIE+LOLA PERSONAL DOORSIGN,2.95
