Description,Price
CHOCOLATE 1 WICK MORRIS BOX CANDLE,4.25
BLUE FLOCK GLASS CANDLEHOLDER,1.65
RECIPE BOX WITH METAL HEART,7.95
SET OF THREE 50'S GIFT WRAPS ,1.95
CHRISTMAS CARD STACK OF PRESENTS,0.42
COLOUR GLASS. STAR T-LIGHT HOLDER,3.25
PORCELAIN BUTTERFLY OIL BURNER,2.95
CINAMMON SET OF 9 T-LIGHTS,0.85
RED STAR CARD HOLDER,2.95
IVY HEART WREATH,6.75
S/4 VALENTINE DECOUPAGE HEART BOX,2.95
FAIRY CAKE FLANNEL ASSORTED COLOUR,2.55
CERAMIC STRAWBERRY MONEY BOX,2.55
CHRISTMAS PUDDING TRINKET POT ,1.45
RETRO SPOT TEA SET CERAMIC 11 PC ,4.95
"SWISS ROLL TOWEL, PINK  SPOTS",2.95
"SWISS ROLL TOWEL, CHOCOLATE  SPOTS",2.95
TEA TIME MUG IN GIFT BOX,2.95
SET/4 PINK ORCHID CANDLES IN BOWL,1.65
3 GARDENIA MORRIS BOXED CANDLES,4.25
SET/3 ROSE CANDLE IN JEWELLED BOX,4.25
ASSORTED TUTTI FRUTTI  FOB NOTEBOOK,0.85
ASSORTED TUTTI FRUTTI PEN,0.85
PAINTED METAL PEARS ASSORTED,1.69
ASSORTED COLOUR BIRD ORNAMENT,1.69
JUMBO BAG OWLS,1.95
JUMBO STORAGE BAG SUKI,1.95
JUMBO BAG STRAWBERRY,1.95
PARTY FOOD SHOPPER BAG,1.25
STRAWBERRY CANDY BAG,1.25
RED SPOTTY CANDY BAG,1.25
PLEASE ONE PERSON  METAL SIGN,2.1
"DIAMANTE HEART SHAPED WALL MIRROR, ",12.75
"WALL MIRROR , DIAMANTE OVAL SHAPE",9.95
SPOTS DESIGN MUG W PINK INSIDE,1.65
RETRO SPOT SMALL MILK JUG,2.55
RETRO SPOT TRADITIONAL TEAPOT ,7.95
PACK OF 12 PINK SPOT TISSUES ,0.29
PACK OF 12 RED SPOTTY TISSUES ,0.29
FULL ENGLISH BREAKFAST PLATE,3.75
WOODEN FRAME ANTIQUE WHITE ,2.95
SWEETHEART KEY CABINET,6.75
CAMOFLAGE DESIGN TEDDY,2.55
JAPANESE CROCHETED ANIMAL,0.42
RETRO SPOT TEA SET CERAMIC 11 PC ,4.95
PACK OF 72 RETRO SPOT CAKE CASES,0.55
JIGSAW TREE WITH BIRDHOUSE,1.45
MINI FUNKY DESIGN TAPES,0.85
SPACE FROG,1.25
SPACE CADET BLACK,1.25
HI TEC ALPINE HAND WARMER,1.65
UNION JACK HOT WATER BOTTLE ,5.95
BOX OF 9 PEBBLE CANDLES,1.95
KINGS CHOICE GIANT TUBE MATCHES,2.55
SWALLOW GIANT TUBE MATCHES,2.55
,0
ABSTRACT CIRCLE JOURNAL ,2.55
FRYING PAN RED POLKADOT ,4.25
EMPIRE BIRTHDAY CARD,0.42
COLOUR GLASS. STAR T-LIGHT HOLDER,2.75
"DOG BOWL , CHASING BALL DESIGN",3.75
CAT BOWL ,2.55
HEART FILIGREE DOVE  SMALL,1.25
WRAP WINTER FOREST,0.42
15CM CHRISTMAS GLASS BALL 20 LIGHTS,6.95
RED HANGING METAL STAR TLIGHT HLDR,3.39
WHITE HANGING HEART T-LIGHT HOLDER,2.55
PAINTED METAL PEARS ASSORTED,1.69
ASSORTED COLOUR BIRD ORNAMENT,1.69
PINK CHERRY LIGHTS,5.45
 WHITE CHERRY LIGHTS,5.45
CHARLIE AND LOLA CHARLOTTE BAG,1.65
MUMMY MOUSE RED GINGHAM RIBBON,5.45
BABY MOUSE RED GINGHAM DRESS,4.25
CHRYSANTHEMUM NOTEBOOK,1.65
CHRYSANTHEMUM  JOURNAL,2.55
BLUE PAISLEY JOURNAL ,2.55
BLUE PAISLEY NOTEBOOK,1.65
GREEN FERN NOTEBOOK,1.65
ABSTRACT CIRCLES NOTEBOOK,1.65
GREEN FERN JOURNAL ,2.55
BLUE SPOTS  WRAP,0.42
RED SPOTS  WRAP ,0.42
EDWARDIAN PARASOL BLACK,5.95
EDWARDIAN PARASOL RED,5.95
EDWARDIAN PARASOL NATURAL,5.95
FROSTED BOX 9 WHITE T-LIGHT CANDLES,0.42
BOX OF 9 PEBBLE CANDLES,1.95
RED DINER WALL CLOCK,8.5
EAU DE NIL DINER WALL CLOCK,8.5
WOODEN FRAME ANTIQUE WHITE ,2.95
BLUE DINER WALL CLOCK,8.5
METAL SIGN EMPIRE TEA,2.95
BOMBS AWAY METAL SIGN,2.1
VINTAGE SNAKES & LADDERS,3.75
BINGO SET,3.75
PINK CHERRY LIGHTS,6.75
 WHITE CHERRY LIGHTS,6.75
 SILVER CHERRY LIGHTS,6.75
LIGHT PINK CHERRY LIGHTS,6.75
WHITE BEADED GARLAND STRING 20LIGHT,6.35
BLACK DINER WALL CLOCK,8.5
,0
lost,0
CHINESE DRAGON PAPER LANTERNS,0.42
BLUE PAPER PARASOL ,2.95
RED PAPER PARASOL,2.95
ASSORTED COLOURS SILK FAN,0.65
PAPER CHAIN KIT 50'S CHRISTMAS ,2.95
damages,0
SET 3 WICKER LOG BASKETS,19.95
RHOMBUS CRYSTAL PERFUME BOTTLE,1.95
PINK CHERRY LIGHTS,6.75
WILLOW BRANCH LIGHTS.,6.75
GREEN CHERRY LIGHTS,6.75
 WHITE CHERRY LIGHTS,6.75
BLACK CHERRY LIGHTS,6.75
GOLD  CHERRY LIGHTS,6.75
 SILVER CHERRY LIGHTS,6.75
TABLE LAMP WHITE SHADE WOOD BASE,4.65
FLOOR LAMP SHADE WOOD BASE,8.49
MIRROR MOSAIC VOTIVE HOLDER,1.85
CHRISTMAS PUDDING TRINKET POT ,1.45
"DOG BOWL , CHASING BALL DESIGN",3.75
CAT BOWL ,2.55
OPULENT VELVET CANDLE IN BOX,1.25
RED CHARLIE+LOLA PERSONAL DOORSIGN,2.95
BLUE CHARLIE+LOLA PERSONAL DOORSIGN,2.95
CHRISTMAS CRAFT WHITE FAIRY ,1.45
WHITE HANGING HEART T-LIGHT HOLDER,2.95
S/4 CACTI CANDLES,4.95
ANGEL DECORATION PAINTED ZINC ,0.65
PINK FLOWER FABRIC PONY,3.75
RED SPOTTY PURSE ,2.95
EIGHT PIECE DINOSAUR SET,1.25
CHRISTMAS HANGING HEART WITH BELL,1.25
WHITE CHRISTMAS TREE DECORATION ,0.42
WHITE CHRISTMAS HEART DECORATION,0.42
GINGHAM HEART  DOORSTOP RED,4.25
ZINC WILLIE WINKIE  CANDLE STICK,0.85
HOT WATER BOTTLE TEA AND SYMPATHY,3.95
SMALL RETRO SPOT MUG IN BOX  WHITE,3.75
RED SPOTTY SHOPPING BAG,2.55
RETRO RED SPOTTY WASHING UP GLOVES,2.1
HEART IVORY TRELLIS SMALL,1.25
WHITE HANGING HEART T-LIGHT HOLDER,2.95
PAINTED BIRD ASSORTED CHRISTMAS,1.69
ASSORTED COLOUR BIRD ORNAMENT,1.69
WRAP PINK FAIRY CAKES ,0.42
CHRYSANTHEMUM SKETCHBOOK ,2.95
VINYL RECORD FRAME SILVER,3.39
BLACK RECORD COVER FRAME,3.39
"GARLAND, MAGIC GARDEN 1.8M",1.95
GREEN CHRISTMAS TREE CARD HOLDER,3.75
WHITE HANGING HEART T-LIGHT HOLDER,2.55
ANTIQUE SILVER TEA GLASS ETCHED,1.25
 VINTAGE DESIGN GIFT TAGS,0.85
 RED/WHITE DOT MINI CASES,6.35
POTTING SHED TEA MUG,1.25
BLUE DINER WALL CLOCK,8.5
RED DINER WALL CLOCK,8.5
WHITE SKULL HOT WATER BOTTLE ,3.75
SET OF THREE 50'S GIFT WRAPS ,1.65
HOME SWEET HOME MUG,1.06
RED HANGING HEART T-LIGHT HOLDER,2.95
HANGING HEART ZINC T-LIGHT HOLDER,0.85
PAPER CHAIN KIT 50'S CHRISTMAS ,2.55
RETRO SPOT TRADITIONAL TEAPOT ,7.95
HOT WATER BOTTLE TEA AND SYMPATHY,3.45
AFGHAN SLIPPER SOCK PAIR,3.45
CHICK GREY HOT WATER BOTTLE,2.95
PACK OF 72 RETRO SPOT CAKE CASES,0.42
PACK OF 60 DINOSAUR CAKE CASES,0.42
PACK OF 60 PINK PAISLEY CAKE CASES,0.42
72 SWEETHEART FAIRY CAKE CASES,0.42
BUTTERFLY WATER TRANSFER TATTOOS ,0.65
DINOSAURS WATER TRANSFER TATTOOS ,0.65
RED SPOTTY BOWL,1.25
GREEN SPOTTY CUP,0.85
RED SPOTTY CUP,0.85
RED SPOT HEART HOT WATER BOTTLE,4.95
RED 3 PIECE MINI DOTS CUTLERY SET,3.75
GREEN 3 PIECE MINI DOTS CUTLERY SET,3.75
PACK OF 60 DINOSAUR CAKE CASES,0.55
BAKING SET 9 PIECE RETROSPOT ,4.95
RED SPOTTY EGG CUP ,1.25
SET/6 RED SPOTTY PAPER CUPS,0.65
SET/6 RED SPOTTY PAPER PLATES,0.85
RETRO SPOT CAKE STAND,10.95
RETRO SPOTS BUTTER DISH,4.95
RETRO SPOT SMALL MILK JUG,2.55
RETRO SPOT TRADITIONAL TEAPOT ,7.95
RED SPOTTY BISCUIT TIN,3.75
RED SPOTTY ROUND CAKE TINS,9.95
"SET 3 RED SPOT TIN TEA,COFFEE,SUGAR",4.95
PACK OF 72 RETRO SPOT CAKE CASES,0.55
SET/5 BLUE SPOTTY LID GLASS BOWLS,2.95
SET/5 RED SPOTTY LID GLASS BOWLS,2.95
PINK FAIRY CAKE CHILD'S APRON,1.95
72 SWEETHEART FAIRY CAKE CASES,0.55
PACK OF 60 PINK PAISLEY CAKE CASES,0.55
CREAM SLICE FLANNEL PINK SPOT ,2.95
TEATIME CAKE TIN WITH HANDLE,9.95
SET OF 4 FAIRY CAKES COASTERS ,1.25
FAIRY CAKE PLACEMATS,3.75
60 TEATIME FAIRY CAKE CASES,0.55
SET OF 36 TEATIME PAPER DOILIES,1.45
TEA TIME CAKE STAND IN GIFT BOX,10.75
GRAND CHOCOLATECANDLE,1.45
HEART MEASURING SPOONS LARGE,1.65
GLASS  BEURRE DISH,3.95
"POPCORN HOLDER , SMALL ",0.85
RETRO SPOT SUGAR JAM BOWL,2.55
DOVE DECORATION PAINTED ZINC ,0.65
CHRISTMAS TREE PAINTED ZINC ,0.65
STAR DECORATION PAINTED ZINC ,0.65
HEART DECORATION PAINTED ZINC ,0.65
CHRISTMAS HANGING HEART WITH BELL,1.25
CHRISTMAS HANGING TREE WITH BELL,1.25
CHRISTMAS HANGING STAR WITH BELL,1.25
CINAMMON & ORANGE WREATH,6.75
IVY HEART WREATH,6.75
ANGEL DECORATION STARS ON DRESS,0.42
S/3 TEAR DROP CUT GLASS DECORATION,1.25
ZINC WILLIE WINKIE  CANDLE STICK,0.85
HANGING HEART ZINC T-LIGHT HOLDER,0.85
WHITE HANGING HEART T-LIGHT HOLDER,2.95
VICTORIAN GLASS HANGING T-LIGHT,1.25
MULTICOLOUR GLASS PLATE,0.55
WOODEN CHRISTMAS TREE 3 HANGING,0.42
PINK HEART CANDY BUTTON CALCULATOR,2.1
EDWARDIAN PARASOL BLACK,4.6
UNION JACK FLAG PASSPORT COVER ,1.69
PINK HEART SHAPE EGG FRYING PAN,1.25
RED WOOLLY HOTTIE WHITE HEART.,2.95
PINK BLUE FELT CRAFT TRINKET BOX,1.06
PINK MARSHMALLOW SCARF KNITTING KIT,2.55
EDWARDIAN PARASOL RED,4.6
TOAST ITS - BEST MUM,1.05
LADS ONLY TISSUE BOX,1.25
RED ORGANIC CANDLE IN GLASS,0.85
6 CHOCOLATE LOVE HEART T-LIGHTS,1.69
SET/3 POT PLANT CANDLES,4.95
CREAM SLICE FLANNEL PINK SPOT ,2.55
JUMBO BAG RED WHITE SPOTTY ,1.65
WHITE HANGING HEART T-LIGHT HOLDER,2.55
LUNCH BAG  BLACK SKULL.,1.45
RECORD FRAME 7" SINGLE SIZE ,2.1
SET 12 PEAR BOTANICAL T-LIGHTS,2.55
S/4 CACTI CANDLES,4.25
ROSE SCENT CANDLE IN JEWELLED BOX,3.81
SET OF 3 COLOURED  FLYING DUCKS,4.65
LADS ONLY TISSUE BOX,1.25
RED ORGANIC CANDLE IN GLASS,0.85
UNION JACK FLAG PASSPORT COVER ,1.69
CREAM SLICE FLANNEL PINK SPOT ,2.55
SMALL FAIRY CAKE FRIDGE MAGNETS,1.45
KASBAH LANTERN WITH GLASS ,4.25
HANGING MEDINA LANTERN LARGE,3.75
EMPIRE BIRTHDAY CARD,0.42
SWALLOWS GREETING CARD,0.42
SKULLS GREETING CARD,0.42
CLASSIC METAL BIRDCAGE PLANT HOLDER,12.75
GOTHIC CARRIAGE LANTERN,5.95
6 RIBBONS EMPIRE  ,1.65
SCANDINAVIAN REDS RIBBONS,1.25
 VINTAGE DESIGN GIFT TAGS,0.85
RIBBON REEL STRIPES DESIGN ,1.65
ROTATING SILVER ANGELS T-LIGHT HLDR,2.55
SET/10 PINK SPOTTY PARTY CANDLES,1.25
SET OF 6 GIRLS CELEBRATION CANDLES,1.25
"DOG BOWL , CHASING BALL DESIGN",3.75
RIBBON REEL HEARTS DESIGN ,1.65
SET OF THREE 50'S GIFT WRAPS ,1.95
COFFEE MUG APPLES DESIGN,2.55
JOY WOODEN BLOCK LETTERS,4.95
ANTIQUE SILVER TEA GLASS ENGRAVED,1.25
ANTIQUE SILVER TEA GLASS ETCHED,1.25
LIGHT BIRD HOUSE TREE DECORATION,0.85
RETRO SPOT TRADITIONAL TEAPOT ,7.95
RED HANGING HEART T-LIGHT HOLDER,2.95
RETRO SPOT CAKE STAND,10.95
FLORAL ELEPHANT SOFT TOY,4.25
CAKE STAND VICTORIAN FILIGREE LARGE,8.5
CREAM SLICE FLANNEL PINK SPOT ,2.95
SET/3 RUSSIAN DOLL STACKING TINS,4.95
LUNCHBOX WITH CUTLERY FAIRY CAKES ,2.55
PAPER CHAIN KIT 50'S CHRISTMAS ,2.95
FAMILY ALBUM WHITE PICTURE FRAME,8.5
RETRO SPOTS PUDDING BOWL,4.25
HANGING JAM JAR T-LIGHT HOLDER,0.85
EDWARDIAN TOILET ROLL UNIT ,12.75
WOODLAND DESIGN  COTTON TOTE BAG,2.25
BIG PINK POODLE,19.95
SET/20 RED SPOTTY PAPER NAPKINS ,0.85
SMALL MARAKESH LANTERN ON STICK,3.75
ASSORTED COLOUR BIRD ORNAMENT,1.69
RED SPOTTY COIR DOORMAT,6.75
BAKING SET 9 PIECE RETROSPOT ,4.95
WOOD 2 DRAWER CABINET WHITE FINISH,5.95
SNOWSTORM PHOTO FRAME FRIDGE MAGNET,0.85
RETRO SPOT TEA SET CERAMIC 11 PC ,4.95
LADLE LOVE HEART RED ,0.42
SIX STRING SCANDINAVIAN HEART DECS,2.95
HOME BUILDING BLOCK WORD,5.95
12 DAISY PEGS IN WOOD BOX,1.65
BIRD DECORATION GREEN  SPOT,0.85
15CM CHRISTMAS GLASS BALL 20 LIGHTS,7.95
BIRD DECORATION RED SPOT,0.85
SWALLOWS GREETING CARD,0.42
TEA PARTY BIRTHDAY CARD,0.42
12 MINI TOADSTOOL PEGS,1.25
OCEAN STRIPE HAMMOCK ,7.95
ARCHED GREY MIRROR,12.75
WHITE HANGING HEART T-LIGHT HOLDER,2.95
VICTORIAN SEWING BOX SMALL ,5.95
VICTORIAN SEWING BOX LARGE,12.75
RED SPOT HEART HOT WATER BOTTLE,4.95
RED/WHITE DOTS RUFFLED UMBRELLA,5.95
TWO DOOR CURIO CABINET,12.75
GLASS CAKE STAND MIRRORED BASE,14.95
VINTAGE BEAD COSMETIC BAG ,3.35
VINTAGE BEAD PINK EVENING BAG,4.25
VINTAGE BEAD PINK SCARF ,7.95
VINTAGE BEAD PINK PURSE ,2.95
JAPANESE CROCHETED ANIMAL,0.42
DINOSAUR KEYRINGS ASSORTED,0.21
ASSTD DESIGN BUBBLE GUM RING,0.21
SET/6 3D KIT CARDS FOR KIDS,0.85
BLUE PULL BACK RACING CAR,0.55
FUNKY GIRLZ ASST MAGNETIC MEMO PAD,0.65
REX CASH+CARRY JUMBO SHOPPER,0.95
WOODEN BOX OF DOMINOES,1.25
NOEL WOODEN BLOCK LETTERS ,5.95
BAKING SET 9 PIECE RETROSPOT ,4.95
FELTCRAFT DOLL MOLLY,2.95
GIRLS ALPHABET IRON ON PATCHES ,0.21
DOOR MAT MULTICOLOUR STRIPE,6.75
RED VICTORIAN FABRIC OVAL BOX,0.42
BLUE VICTORIAN FABRIC HEART BOX,0.42
AREA PATROLLED METAL SIGN,1.69
PACK 20 ENGLISH ROSE PAPER NAPKINS,0.85
ENGLISH ROSE NOTEBOOK A7 SIZE,0.42
 WHITE CHERRY LIGHTS,5.45
DOOR MAT ENGLISH ROSE ,6.75
VINTAGE BEAD PINK EVENING BAG,4.25
ASSORTED FLORAL SECATEURS,1.95
PACK 20 DOLLY PEGS,0.85
ASSORTED COLOUR BIRD ORNAMENT,1.69
DOOR MAT FRIENDSHIP ,6.75
SINGLE HEART ZINC T-LIGHT HOLDER,0.95
60 GOLD AND SILVER FAIRY CAKE CASES,0.55
3 GARDENIA MORRIS BOXED CANDLES,3.81
ROMANTIC PINKS RIBBONS ,1.25
DOORMAT HEARTS,6.75
WHITE HANGING HEART T-LIGHT HOLDER,2.95
ASSORTED COLOUR SILK COSMETIC PURSE,2.1
JASMINE VOTIVE CANDLE,0.29
RETRO RED SPOTTY WASHING UP GLOVES,2.1
SET/5 BLUE SPOTTY LID GLASS BOWLS,2.95
SET/5 RED SPOTTY LID GLASS BOWLS,2.95
RED SPOTTY OVEN GLOVE DOUBLE,2.95
RED SPOTTY APRON ,5.95
SET/20 RED SPOTTY PAPER NAPKINS ,0.85
PAINTED METAL PEARS ASSORTED,1.69
RED SPOTTY OVEN GLOVE ,1.25
RED SPOTTY PEG BAG,2.1
HOME SWEET HOME METAL SIGN ,2.95
PARTY METAL SIGN ,1.45
PLEASE ONE PERSON  METAL SIGN,2.1
PACK OF 72 RETRO SPOT CAKE CASES,0.55
RED SPOTTY CUP,0.85
"FRENCH BOTTLE , LAVENDER",1.65
FIRST AID TIN,3.25
RETRO SPOT CANDLE  LARGE,2.55
GLASS HEART T-LIGHT HOLDER ,0.85
RELAX LARGE WOOD LETTERS,15.95
RED  SPOTTY COFFEE  MUG,1.75
RETRO SPOT CERAMIC TOASTRACK,3.45
DAIRY MAID LARGE MILK JUG,4.95
RED HANGING METAL STAR TLIGHT HLDR,3.39
SMALL HEART MEASURING SPOONS,0.85
FOUR HOOK  WHITE LOVEBIRDS,2.1
60 GOLD AND SILVER FAIRY CAKE CASES,0.55
RED SPOTTY ROUND CAKE TINS,9.95
PACK 20 ENGLISH ROSE PAPER NAPKINS,0.85
SET/20 RED SPOTTY PAPER NAPKINS ,0.85
SET OF 72 RETRO SPOT PAPER  DOILIES,1.45
CERAMIC CAKE STAND + HANGING CAKES,9.95
RETRO SPOT CAKE STAND,10.95
CAKE STAND LACE WHITE,4.25
CAKE STAND WHITE TWO TIER LACE,8.5
POSTAGE,18
RETRO SPOT CAKE STAND,10.95
RETRO PLASTIC ELEPHANT TRAY,0.85
CROSS STITCH ALPHABET CUSHION COVER,5.95
BLUE SPOTTY BOWL,1.25
PAPER CHAIN KIT 50'S CHRISTMAS ,2.95
SCOTTIE DOG HOT WATER BOTTLE,4.95
CHOCOLATE HOT WATER BOTTLE,4.95
SILVER VANILLA FLOWER CANDLE POT,3.75
PAINTED BIRD ASSORTED CHRISTMAS,1.69
COSY HOUR CIGAR BOX MATCHES ,1.25
RETRO SPOT SMALL TUBE MATCHES,1.65
BROWN CHECK CAT DOORSTOP ,4.25
MINATURE COLOURED GARDENING SET,4.95
ASSORTED TUTTI FRUTTI  FOB NOTEBOOK,0.85
WHITE BEADED GARLAND STRING 20LIGHT,6.35
LIGHT PINK CHERRY LIGHTS,5.45
 WHITE CHERRY LIGHTS,5.45
RETRO SPOT CAKE STAND,10.95
WHITE TISSUE REAM,7.95
NOEL WOODEN BLOCK LETTERS ,5.95
HEART FILIGREE DOVE LARGE,1.65
RED SPOT HEART HOT WATER BOTTLE,4.95
PINK/BROWN DOTS RUFFLED UMBRELLA,5.95
RED/WHITE DOTS RUFFLED UMBRELLA,5.95
VINTAGE CREAM 3 BASKET CAKE STAND,9.95
ANTIQUE LILY FAIRY LIGHTS,4.95
VINTAGE SNAP CARDS,0.85
WOODEN BOX OF DOMINOES,1.25
VINTAGE SNAKES & LADDERS,3.75
BLOSSOM IMAGES SCRAP BOOK SET,1.25
WHITE HANGING HEART T-LIGHT HOLDER,2.95
UNION JACK GUNS & ROSES  DOORMAT,6.75
WHITE SPOT RED CERAMIC DRAWER KNOB,1.25
JUMBO  BAG BAROQUE BLACK WHITE,1.95
JUMBO STORAGE BAG SUKI,1.95
JUMBO STORAGE BAG SKULLS,1.95
PACK OF 72 RETRO SPOT CAKE CASES,0.55
CAMOUFLAGE LED TORCH,1.69
FOOD CONTAINER SET 3 LOVE HEART ,1.95
SCOTTIE DOG HOT WATER BOTTLE,4.95
T-LIGHT HOLDER WHITE LACE,0.85
WHITE LOVEBIRD LANTERN,2.95
PAPER CHAIN KIT RETRO SPOT,2.95
PAPER CHAIN KIT 50'S CHRISTMAS ,2.95
TEA BAG PLATE RED SPOTTY ,0.85
"CHARLOTTE BAG , SUKI DESIGN",0.85
"CHARLOTTE BAG , PINK/WHITE SPOTS",0.85
ASSORTED COLOUR BIRD ORNAMENT,1.69
CHARLIE AND LOLA FIGURES TINS,9.95
CHARLIE AND LOLA CHARLOTTE BAG,1.65
JUMBO BAG RED WHITE SPOTTY ,1.95
SMALL RED SPOT  WINDMILL,1.25
SET OF 72 RETRO SPOT PAPER  DOILIES,1.45
PINK SPOTTY CHILDS UMBRELLA,3.25
RED SPOTTY CUP,0.85
RETRO SPOT TRADITIONAL TEAPOT ,7.95
RETRO SPOT SUGAR JAM BOWL,2.55
RETRO SPOT SMALL MILK JUG,2.55
FRYING PAN UNION FLAG,4.25
PAPER CHAIN KIT 50'S CHRISTMAS ,2.55
WHITE HANGING HEART T-LIGHT HOLDER,2.55
CREAM SWEETHEART TRAYS,9.95
RED SPOTTY COIR DOORMAT,5.95
STRAWBERRY BATH SPONGE ,1.25
APPLE BATH SPONGE,1.25
SANDWICH BATH SPONGE,1.25
WATERMELON BATH SPONGE,1.25
"POPCORN HOLDER , SMALL ",0.72
RED SPOTTY CUP,0.72
GREEN SPOTTY CUP,0.72
PINK SPOTTY BOWL,1.06
BLUE SPOTTY BOWL,1.06
GREEN SPOTTY BOWL,1.06
PACK OF 72 RETRO SPOT CAKE CASES,0.42
SET/6 RED SPOTTY PAPER PLATES,0.64
SET/6 RED SPOTTY PAPER CUPS,0.65
36 PENCILS TUBE RED SPOTTY,1.06
FULL ENGLISH BREAKFAST PLATE,3.39
RED SPOTTY ROUND CAKE TINS,8.95
VINTAGE HEADS AND TAILS CARD GAME ,1.06
BAG 125g SWIRLY MARBLES,0.36
BINGO SET,3.75
MULTICOLOUR 3D BALLS GARLAND,2.1
BOX OF 24 COCKTAIL PARASOLS,0.42
STRING OF 20 ROSE LIGHTS,10.95
 WHITE CHERRY LIGHTS,5.45
JUMBO BAG RED WHITE SPOTTY ,1.65
JUMBO STORAGE BAG SUKI,1.65
JUMBO BAG STRAWBERRY,1.65
SET/6 RED SPOTTY PAPER PLATES,0.64
SMALL RETRO SPOT MUG IN BOX  WHITE,2.75
SMALL RETRO SPOT MUG IN BOX  RED,2.75
WHITE TISSUE REAM,7.95
HOT WATER BOTTLE TEA AND SYMPATHY,3.45
CHRISTMAS CRAFT HEART STOCKING ,1.85
RED SPOT HEART HOT WATER BOTTLE,4.25
WORLD WAR 2 GLIDERS ASSTD DESIGNS,0.18
RED WOOLLY HOTTIE WHITE HEART.,2.95
SCOTTIE DOG HOT WATER BOTTLE,4.25
FAIRY CAKE CANDLES,1.25
DOOR MAT ENGLISH ROSE ,5.95
DOOR MAT BLACK FLOCK ,5.95
RED/WHITE DOTS RUFFLED UMBRELLA,5.95
STRAWBERRY SCENTED SET/9 T-LIGHTS,0.85
CINAMMON SET OF 9 T-LIGHTS,0.85
SET/20 RED SPOTTY PAPER NAPKINS ,0.85
CHRISTMAS TOILET ROLL,1.06
SET OF 6 GIRLS CELEBRATION CANDLES,1.25
PACK OF 72 RETRO SPOT CAKE CASES,0.42
SWEETHEART CERAMIC TRINKET BOX,1.06
STRAWBERRY CERAMIC TRINKET BOX,1.06
RED GINGHAM ROSE JEWELLERY BOX,1.65
WRAP CHRISTMAS SCREEN PRINT,0.42
CHOCOLATE CALCULATOR,1.65
PINK DOUGHNUT TRINKET POT ,1.45
CREAM HEART CARD HOLDER,3.39
LARGE HEART MEASURING SPOONS,1.45
CHOCOLATE HOT WATER BOTTLE,4.25
SET3 BOOK BOX GREEN GINGHAM FLOWER ,3.75
"POPCORN HOLDER , SMALL ",0.72
PAPER CHAIN KIT 50'S CHRISTMAS ,2
DOOR MAT BLACK FLOCK ,6.75
FANCY FONT HOME SWEET HOME DOORMAT,6.75
SCOTTS ROSES TILE COASTER,1.25
DISCO BALL ROTATOR BATTERY OPERATED,4.25
MIRRORED DISCO BALL ,5.95
DISCO BALL CHRISTMAS DECORATION,0.1
NOEL GARLAND PAINTED ZINC ,1.65
GARLAND WITH HEARTS AND BELLS,4.95
S/4 BURGUNDY WINE DINNER CANDLES,1.25
ETCHED GLASS STAR TREE DECORATION,1.25
COLOUR GLASS. STAR T-LIGHT HOLDER,2.75
"SET 3 RED SPOT TIN TEA,COFFEE,SUGAR",4.25
BLUE/WHITE RIBBED MELAMINE JUG,7.95
60 GOLD AND SILVER FAIRY CAKE CASES,0.55
PACK OF 72 RETRO SPOT CAKE CASES,0.55
PACK OF 72 SKULL CAKE CASES,0.55
PACK OF 60 PINK PAISLEY CAKE CASES,0.55
TOAST ITS - DINOSAUR,1.25
TOAST ITS - FAIRY FLOWER,1.25
TOAST ITS - I LOVE YOU ,1.25
SILVER HANGING T-LIGHT HOLDER DOME,1.65
BLUE  SPOTTY CUP,0.85
BLUE  SPOTTY PLATE ,1.69
"POPCORN HOLDER , LARGE",1.65
PINK HEART SHAPE EGG FRYING PAN,1.65
SKULL LUNCHBOX WITH CUTLERY ,2.55
LUNCHBOX WITH CUTLERY FAIRY CAKES ,2.55
RED 3 PIECE MINI DOTS CUTLERY SET,3.75
GREEN 3 PIECE MINI DOTS CUTLERY SET,3.75
BLUE 3 PIECE MINI DOTS CUTLERY SET,3.75
PINK 3 PIECE MINI DOTS CUTLERY SET,3.75
LARGE CIRCULAR MIRROR MOBILE,1.25
GLITTER CHRISTMAS TREE WITH BELLS,1.95
GLITTER STAR GARLAND WITH BELLS ,3.75
PIZZA SLICE DISH,1.25
SET/5 BLUE SPOTTY LID GLASS BOWLS,2.95
BLUE SPOTTY BOWL,1.25
WHITE BELL HONEYCOMB PAPER ,1.65
CHRISTMAS CRAFT WHITE FAIRY ,1.45
GAOLERS KEYS DECORATIVE GARDEN ,3.75
WOODEN BOX OF DOMINOES,1.25
 3 STRIPEY MICE FELTCRAFT,1.95
EASTER CRAFT 4 CHICKS ,1.95
CHRISTMAS CRAFT LITTLE FRIENDS,2.1
RED SPOTTY CHILDS UMBRELLA,3.25
SET/4 WHITE RETRO STORAGE CUBES ,34.95
BLACK EAR MUFF HEADPHONES,4.65
SET OF 3 COLOURED  FLYING DUCKS,4.65
GARDEN PATH JOURNAL,2.55
ABSTRACT CIRCLE JOURNAL ,2.55
RED SPOT HEART HOT WATER BOTTLE,4.95
RED WHITE SCARF  HOT WATER BOTTLE,3.95
RED/WHITE DOTS RUFFLED UMBRELLA,5.95
BLACK/BLUE DOTS RUFFLED UMBRELLA,5.95
FOLDING UMBRELLA  CHOC/WHITE  SPOT,4.95
FOLDING UMBRELLA  CREAM/MULTI  SPOT,4.95
OVERNIGHT BAG VINTAGE ROSE PAISLEY,4.95
RED GINGHAM ROSE JEWELLERY BOX,1.65
GREEN GINGHAM FLOWER JEWELLERY BOX,1.65
GREEN FERN JOURNAL ,2.55
PINK ROSE FABRIC MIRROR,1.25
BLUE ROSE FABRIC MIRROR,1.25
RETRO SPOT CAKE STAND,10.95
"WALL MIRROR , DIAMANTE OVAL SHAPE",9.95
METAL SHELF WITH RAIL ,8.5
CREAM HEART CARD HOLDER,3.95
RETRO SPOT TRADITIONAL TEAPOT ,7.95
EAU DE NIL DINER WALL CLOCK,8.5
BLUE DINER WALL CLOCK,8.5
GRAND CHOCOLATECANDLE,1.45
CAMOUFLAGE LED TORCH,1.69
VICTORIAN SEWING BOX SMALL ,5.95
GIRLY PINK TOOL SET,4.95
FELTCRAFT DOLL ROSIE,2.95
FLOWERS WALL THERMOMETER,2.55
WAKE UP COCKEREL WALL THERMOMETER,2.55
FELTCRAFT DOLL EMILY,2.95
 3 STRIPEY MICE FELTCRAFT,1.95
COSY SLIPPER SHOES LARGE GREEN,2.95
COSY SLIPPER SHOES SMALL  RED ,2.95
COSY SLIPPER SHOES LARGE RED,2.95
COSY SLIPPER SHOES SMALL GREEN,2.95
GIRLY PINK TOOL SET,4.95
CHOCOLATE HOT WATER BOTTLE,4.95
12 PENCILS TALL TUBE SKULLS,0.85
12 PENCILS TALL TUBE RED SPOTTY,0.85
12 PENCILS TALL TUBE WOODLAND,0.85
200 RED + WHITE BENDY STRAWS,1.25
SCOTTIE DOG HOT WATER BOTTLE,4.95
RED SPOTTY APRON ,5.95
HOT WATER BOTTLE TEA AND SYMPATHY,3.95
DINOSAURS  WRITING SET ,1.65
BALLOONS  WRITING SET ,1.65
CHOCOLATE CALCULATOR,1.65
RED STRIPE CERAMIC DRAWER KNOB,1.25
RED SPOT CERAMIC DRAWER KNOB,1.25
ASS FLORAL PRINT TORCH,1.65
PINK FLORAL FELTCRAFT SHOULDER BAG,3.75
FELTCRAFT DOLL ROSIE,2.95
PINK HEART CANDY BUTTON CALCULATOR,2.55
VICTORIAN SEWING BOX SMALL ,5.95
VICTORIAN SEWING BOX MEDIUM,7.95
WEEKEND BAG VINTAGE ROSE PAISLEY,8.5
FRESHWATER PEARL BRACELET PINK,2.55
FRESHWATER PEARL BRACELET GOLD,2.55
ANTIQUE LILY FAIRY LIGHTS,4.95
PACK OF 60 DINOSAUR CAKE CASES,0.55
75 GREEN FAIRY CAKE CASES,0.55
72 SWEETHEART FAIRY CAKE CASES,0.55
PACK OF 60 PINK PAISLEY CAKE CASES,0.55
GEISHA GIRL CHOPSTICKS SET/5,1.95
BAKING SET 9 PIECE RETROSPOT ,4.95
FELTCRAFT DOLL ROSIE,2.95
CHERRY BLOSSOM DECORATIVE FLASK,3.75
WRAP WINTER FOREST,0.42
JUMBO BAG CHARLIE AND LOLA TOYS,2.95
JUMBO STORAGE BAG SUKI,1.95
PATCHWORK PENCIL CASE BUTTERFLY ,2.1
FUNKY WASHING UP GLOVES ASSORTED,2.1
POLKA DOT PISTACHIO PAIL,2.1
SET/10 PINK SPOTTY PARTY CANDLES,1.25
BALLOONS  WRITING SET ,1.65
SET OF 6 HEART CHOPSTICKS,1.25
CUT GLASS T-LIGHT HOLDER OCTAGON,2.55
PACK OF 60 DINOSAUR CAKE CASES,0.55
75 GREEN FAIRY CAKE CASES,0.55
72 SWEETHEART FAIRY CAKE CASES,0.55
ENGLISH ROSE SCISSORS,1.25
JAZZ HEARTS SPIRAL NOTEPAD,0.85
BLUE ROSE FABRIC MIRROR,1.25
ENGLISH ROSE TORCH,1.65
12 PENCILS SMALL TUBE POSY,0.65
ORANGE SCENTED SET/9 T-LIGHTS,0.85
36 PENCILS TUBE WOODLAND,1.25
BABY BOOM RIBBONS ,1.25
BRIGHT BLUES RIBBONS ,1.25
BLUE  SPOTTY PLATE ,1.69
JAZZ HEARTS MAGNETIC MEMO PAD,0.65
BLUE PAISLEY SKETCHBOOK,3.75
SET/6 PINK BIRD T-LIGHT CANDLES,2.1
SET/6 EAU DE NIL BIRD T-LIGHTS,2.1
S/4 IVORY MINI ROSE CANDLE IN BOWL,1.65
BLUE PAISLEY SKETCHBOOK,3.75
SET/20 STRAWBERRY PAPER NAPKINS ,0.85
DINOSAUR LUNCHBOX WITH CUTLERY,2.55
HANGING JAM JAR T-LIGHT HOLDER,0.85
SET/5 BLUE SPOTTY LID GLASS BOWLS,2.95
LUNCHBOX WITH CUTLERY FAIRY CAKES ,2.55
SET/3 RUSSIAN DOLL STACKING TINS,4.95
SET/5 RED SPOTTY LID GLASS BOWLS,2.95
PAPER CHAIN KIT RETRO SPOT,2.95
PAPER CHAIN KIT 50'S CHRISTMAS ,2.95
RED SPOTTY PLATE ,1.69
PINK  SPOTTY PLATE ,1.69
GREEN  SPOTTY PLATE ,1.69
BLUE  SPOTTY PLATE ,1.69
JUMBO STORAGE BAG SKULLS,1.95
12 PENCILS SMALL TUBE POSY,0.65
,0
"CHARLOTTE BAG , PINK/WHITE SPOTS",0.85
LUNCH BAG CARS BLUE,1.65
RED SPOTTY CHARLOTTE BAG,0.85
PACK OF 12 WOODLAND TISSUES ,0.29
PACK OF 12 PINK SPOT TISSUES ,0.29
FROG CANDLE,1.25
ASSORTED TUTTI FRUTTI LARGE PURSE,2.1
PREMIUM CHURCH CANDLE,2.1
SET/6 GARDEN GNOME T-LIGHT CANDLES,2.95
MAGIC GARDEN MOUNT FUJI,2.55
FLOWER FAIRY INCENSE LILY,1.69
FLOWER FAIRY INCENSE ROSE,1.69
200 RED + WHITE BENDY STRAWS,1.25
FAIRY CAKE CANDLES,1.49
ROSE DU SUD OVEN GLOVE,2.95
ASSORTED TUTTI FRUTTI ROUND BOX,1.65
FUNKY WASHING UP GLOVES ASSORTED,2.1
RETRO BLUE SPOTTY WASHING UP GLOVES,2.1
RETRO RED SPOTTY WASHING UP GLOVES,2.1
RETRO PINK SPOT WASHING UP GLOVES,2.1
FUNKY WASHING UP GLOVES ASSORTED,2.1
CERAMIC STRAWBERRY MONEY BOX,2.55
SPACE FROG,1.25
SPACE OWL,1.25
WATERMELON BATH SPONGE,1.25
SANDWICH BATH SPONGE,1.25
SET OF THREE 50'S GIFT WRAPS ,1.95
"POPCORN HOLDER , LARGE",1.45
BLUE FLOCK GLASS CANDLEHOLDER,0.38
PARTY PIZZA DISH PINK+WHITE SPOT ,0.85
PARTY PIZZA DISH GREEN+WHITE SPOT ,0.85
PARTY PIZZA DISH BLUE+WHITE SPOT ,0.85
PARTY PIZZA DISH RED WHITE SPOT ,0.85
ASSORTED INCENSE PACK,0.21
PACK OF 12 WOODLAND TISSUES ,0.29
GRAND CHOCOLATECANDLE,1.45
FAIRY CAKE CANDLES,1.49
JAPANESE CROCHETED ANIMAL,0.42
ROTATING SILVER ANGELS T-LIGHT HLDR,2.55
PACK OF 12 WOODLAND TISSUES ,0.29
MUMMY MOUSE RED GINGHAM RIBBON,5.45
DADDY MOUSE RED GINGHAM BOW TIE,5.45
GINGHAM HEART  DOORSTOP RED,4.25
WHITE ADVENT CANDLE,2.12
PACK OF 12 BLUE PAISLEY TISSUES ,0.29
PACK OF 12 PINK SPOT TISSUES ,0.29
GLITTER CHRISTMAS TREE WITH BELLS,1.95
GLITTER CHRISTMAS HEART ,0.85
CREAM SWEETHEART MINI CHEST,12.75
OPEN CLOSED METAL SIGN,4.95
YELLOW DRAGONFLY HELICOPTER,7.95
BLUE DRAGONFLY HELICOPTER,7.95
LADS ONLY TISSUE BOX,1.25
POTTING SHED ROSE CANDLE,2.95
RETRO SPORT PARTY BAG + STICKER SET,1.65
200 RED + WHITE BENDY STRAWS,1.25
SET/6 RED SPOTTY PAPER PLATES,0.85
12 PENCILS SMALL TUBE SKULL,0.65
VINTAGE HEADS AND TAILS CARD GAME ,1.25
12 MINI TOADSTOOL PEGS,1.25
PACK OF 72 RETRO SPOT CAKE CASES,0.55
SET/6 RED SPOTTY PAPER CUPS,0.65
12 PENCILS SMALL TUBE RED SPOTTY,0.65
VINTAGE SNAP CARDS,0.85
COFFEE MUG APPLES DESIGN,2.55
COFFEE MUG PEARS  DESIGN,2.55
RETRO PLASTIC ELEPHANT TRAY,0.85
PAPER CHAIN KIT 50'S CHRISTMAS ,2.95
FLORAL FOLK STATIONERY SET,2.95
MODERN FLORAL STATIONERY SET,2.95
S/3 ENGLISH LAVENDER SQU CANDLE,1.65
S/3 FRENCH VANILLA SQU CANDLE,1.65
ROSE 3 WICK MORRIS BOX CANDLE,4.25
GARDENIA 3 WICK MORRIS BOXED CANDLE,4.25
KNITTED UNION FLAG HOT WATER BOTTLE,3.75
RETRO PLASTIC ELEPHANT TRAY,0.85
PINK ROSE FABRIC MIRROR,1.25
GOLD FABRIC MIRROR,1.25
RETRO PLASTIC POLKA TRAY,0.42
LETTER "S" BLING KEY RING,1.25
LETTER "J" BLING KEY RING,1.25
ENGLISH ROSE TAPE MEASURE,1.25
12 PENCILS SMALL TUBE RED SPOTTY,0.65
DAISY ERASERS IN BAG,0.42
60 TEATIME FAIRY CAKE CASES,0.55
PACK OF 60 DINOSAUR CAKE CASES,0.55
APPLE BATH SPONGE,1.25
STRAWBERRY BATH SPONGE ,1.25
200 RED + WHITE BENDY STRAWS,1.25
BLUE CALCULATOR RULER,1.25
HEART CALCULATOR,1.25
S/3 ENGLISH LAVENDER SQU CANDLE,1.65
BROCADE RING PURSE ,0.21
POTTING SHED ROSE CANDLE,2.95
WOODLAND STORAGE BOX LARGE ,2.95
SPACE BOY BIRTHDAY CARD,0.42
JUMBO BAG RED WHITE SPOTTY ,1.95
SET OF 4 PASTEL STACKING MUGS,2.55
PACK OF 12 HEARTS DESIGN TISSUES ,0.29
RETRO SPOT SMALL MILK JUG,2.55
RETRO SPOT LARGE MILK JUG,4.95
