Description,Price
REX CASH+CARRY JUMBO SHOPPER,0.95
ASSORTED COLOUR BIRD ORNAMENT,1.69
BLUE FLYING SINGING CANARY,3.75
ABSTRACT CIRCLES SKETCHBOOK ,3.75
ABSTRACT CIRCLES NOTEBOOK,1.65
SET OF 4 DIAMOND NAPKIN RINGS,12.75
STRAWBERRY CERAMIC TRINKET BOX,1.25
BROWN FURRY HOT WATER BOTTLE,3.75
CHICK GREY HOT WATER BOTTLE,3.45
WHITE SKULL HOT WATER BOTTLE ,3.75
KNITTED UNION FLAG HOT WATER BOTTLE,3.75
TEA TIME TEA SET IN GIFT BOX,6.95
TEA TIME TEAPOT IN GIFT BOX,9.95
FAIRY CAKES TABLE CLOCK,8.95
TEA TIME CAKE STAND IN GIFT BOX,10.75
SAVE THE PLANET MUG,1.25
PINK/BROWN DOTS RUFFLED UMBRELLA,5.95
FAIRY CAKE DESIGN UMBRELLA,3.75
BLUE/BROWN DOTS RUFFLED UMBRELLA,5.95
RED SPOTTY CHILDS UMBRELLA,3.25
CORONA MEXICAN TRAY,3.75
SET OF 3 GOLD FLYING DUCKS,6.35
SET OF 3 COLOURED  FLYING DUCKS,5.45
SET OF 3 GOLD FLYING DUCKS,6.35
CLASSIC METAL BIRDCAGE PLANT HOLDER,12.75
WRAP CHRISTMAS SCREEN PRINT,0.42
CHRISTMAS CRAFT HEART STOCKING ,2.1
CHRISTMAS CRAFT WHITE FAIRY ,1.45
 3 STRIPEY MICE FELTCRAFT,1.95
SET OF THREE 50'S GIFT WRAPS ,1.95
IVORY ENCHANTED FOREST PLACEMAT,1.65
DINOSAUR PARTY BAG + STICKER SET,1.65
DINOSAURS  WRITING SET ,1.65
ASSORTED WHITE EMBOSSED CHINA MUGS,2.1
CUT GLASS T-LIGHT HOLDER OCTAGON,2.55
CINAMMON SET OF 9 T-LIGHTS,0.85
SET/6 GOLD REINDEER T-LIGHT CANDLES,1.95
SET/6 SILVER REINDEER T-LIGHTS,1.95
GLITTER BUTTERFLY CLIPS,2.55
HANGING BAUBLE T-LIGHT HOLDER SMALL,2.55
ANTIQUE ALL GLASS CANDLESTICK,2.1
PORCELAIN BUTTERFLY OIL BURNER,2.95
JUMBO BAG TOYS ,1.95
UNION JACK GUNS & ROSES  DOORMAT,6.75
6 RIBBONS SHIMMERING PINKS ,1.65
6 RIBBONS ELEGANT CHRISTMAS ,1.65
6 RIBBONS EMPIRE  ,1.65
RIBBON REEL LACE DESIGN ,2.1
PAPER CHAIN KIT 50'S CHRISTMAS ,2.95
SQUARE MIRROR CURTAIN,7.95
ENGLISH ROSE DESIGN PEG BAG,2.1
DOOR MAT TOPIARY,6.75
DOOR MAT FAIRY CAKE,6.75
DOOR MAT NEW ENGLAND,6.75
JUMBO BAG RED WHITE SPOTTY ,1.95
JUMBO  BAG BAROQUE BLACK WHITE,1.95
VINTAGE UNION JACK CUSHION COVER,4.95
LOVE BUILDING BLOCK WORD,5.95
POTTING SHED TEA MUG,1.25
 PEACE WOODEN BLOCK LETTERS,6.95
WASHROOM METAL SIGN,1.25
POP'S GREASY SPOON METAL SIGN,1.65
HOT BATHS METAL SIGN,2.1
ZINC WILLIE WINKIE  CANDLE STICK,0.85
KASHMIR FOLKART TUMBLERS,2.1
SILVER HANGING T-LIGHT HOLDER DOME,1.65
SILVER HANGING T-LIGHT HOLDER,1.65
SINGLE HEART ZINC T-LIGHT HOLDER,0.95
HANGING HEART ZINC T-LIGHT HOLDER,0.85
WHITE HANGING HEART T-LIGHT HOLDER,2.95
PAINTED BIRD ASSORTED CHRISTMAS,1.69
PAINTED METAL PEARS ASSORTED,1.69
PARTY METAL SIGN ,1.45
POTTERING IN THE SHED METAL SIGN,1.95
VICTORIAN SEWING BOX LARGE,12.75
VICTORIAN SEWING BOX SMALL ,5.95
GOLD MINI TAPE MEASURE ,0.85
SILVER MINI TAPE MEASURE ,0.85
PINK MINI TAPE MEASURE ,0.85
PINK BLUE FELT CRAFT TRINKET BOX,1.25
FELTCRAFT BUTTERFLY HEARTS,1.25
 3 STRIPEY MICE FELTCRAFT,1.65
SEWING SUSAN 21 NEEDLE SET,0.85
S/3 TEAR DROP CUT GLASS DECORATION,1.25
ETCHED GLASS BIRD TREE DECORATION,1.25
RED WOOLLY HOTTIE WHITE HEART.,2.95
SPOTTY  HOME SWEET HOME DOORMAT,5.95
DOOR MAT FAIRY CAKE,5.95
ASSORTED COLOUR BIRD ORNAMENT,1.45
RED REINDEER STRING OF 20 LIGHTS,4.25
WHITE BEADED GARLAND STRING 20LIGHT,5.55
RETRO COFFEE MUGS ASSORTED,1.06
KNITTED UNION FLAG HOT WATER BOTTLE,3.39
RED/WHITE DOTS RUFFLED UMBRELLA,5.95
BLACK/BLUE DOTS RUFFLED UMBRELLA,5.95
BLUE/BROWN DOTS RUFFLED UMBRELLA,5.95
PINK/BROWN DOTS RUFFLED UMBRELLA,5.95
EDWARDIAN PARASOL NATURAL,5.95
EDWARDIAN PARASOL BLACK,5.95
EDWARDIAN PARASOL RED,5.95
GOLD TEDDY BEAR,3.75
SILVER TEDDY BEAR,3.75
VINTAGE UNION JACK DOORSTOP,5.95
VINTAGE UNION JACK CUSHION COVER,4.95
 SILVER CHERRY LIGHTS,6.75
GOLD  CHERRY LIGHTS,6.75
STRING OF 20 ROSE LIGHTS,12.75
BIG DOUGHNUT FRIDGE MAGNETS,0.85
FOLDING UMBRELLA  WHITE/RED  SPOT,4.95
CINAMMON SET OF 9 T-LIGHTS,0.85
SMALL RETRO SPOT MUG IN BOX  WHITE,3.75
LAVENDER SCENTED SET/9 T-LIGHTS,0.85
LARGE MEDINA STAMPED METAL BOWL ,4.95
SHOE SHINE BOX ,9.95
RED SPOTTY PUDDING BOWL,2.1
TEA COSY RED  STRIPE,2.55
FRENCH CHATEAU SMALL FRUITBOWL,4.95
FRYING PAN UNION FLAG,4.25
CORONA MEXICAN TRAY,3.75
KINGS CHOICE MUG,1.25
RED  SPOTTY COFFEE  MUG,2.1
HOME SWEET HOME MUG,1.25
SAVE THE PLANET MUG,1.25
IVORY ENCHANTED FOREST PLACEMAT,1.65
RED ENCHANTED FOREST PLACEMAT,1.65
TEA TIME MUG IN GIFT BOX,2.95
TEA TIME TEAPOT IN GIFT BOX,9.95
TEA TIME CAKE STAND IN GIFT BOX,10.75
ROBIN CHRISTMAS CARD,0.42
CHRISTMAS CARD SINGING ANGEL,0.42
SET 12 LAVENDER  BOTANICAL T-LIGHTS,2.95
S/12 VANILLA  BOTANICAL T-LIGHTS,2.95
SET 12 PEAR BOTANICAL T-LIGHTS,2.95
CHRISTMAS CRAFT WHITE FAIRY ,1.45
CHRISTMAS CRAFT HEART STOCKING ,2.1
CHRISTMAS PUDDING TRINKET POT ,1.45
SET/9 CHRISTMAS T-LIGHTS SCENTED ,1.25
SET/6 SILVER REINDEER T-LIGHTS,1.95
SET OF THREE 50'S GIFT WRAPS ,1.95
SET/6 GOLD REINDEER T-LIGHT CANDLES,1.95
DISCO BALL CHRISTMAS DECORATION,0.12
COSY HOUR CIGAR BOX MATCHES ,1.25
PAPER CHAIN KIT 50'S CHRISTMAS ,2.95
CAKE STAND LOVEBIRD 2 TIER WHITE,9.95
,0
SET OF 3 CASES WOODLAND DESIGN,5.95
BAKING SET 9 PIECE RETROSPOT ,4.95
RED/WHITE SPOT PICNIC BAG,2.95
RED HANGING HEART T-LIGHT HOLDER,2.95
FAIRY CAKE CANDLES,1.49
GRAND CHOCOLATECANDLE,1.45
FAIRY CAKES NOTEBOOK A6 SIZE,0.65
FAIRY CAKES NOTEBOOK A7 SIZE,0.42
ENGLISH ROSE NOTEBOOK A7 SIZE,0.42
36 PENCILS TUBE WOODLAND,1.25
TEA BAG PLATE RED SPOTTY ,0.85
RETRO SPOT SMALL TUBE MATCHES,1.65
COFFEE MUG BLUE PAISLEY DESIGN,2.55
ZINC METAL HEART DECORATION,1.25
 RED/WHITE DOT MINI CASES,7.95
SMALL GLASS HEART TRINKET POT,1.85
VICTORIAN GLASS HANGING T-LIGHT,1.25
LOVEBIRD HANGING DECORATION WHITE ,0.85
HEART IVORY TRELLIS LARGE,1.65
WOODEN BOX ADVENT CALENDAR ,8.95
FOLKART BAUBLE CHRISTMAS DECORATION,0.38
FOLKART ZINC STAR CHRISTMAS DEC,0.85
FOLKART ZINC HEART CHRISTMAS DEC,0.85
WHITE SNOW SCANDINAVIAN STOCKING ,1.25
WOOD 2 DRAWER CABINET WHITE FINISH,5.95
WOODEN FRAME ANTIQUE WHITE ,2.95
ROTATING SILVER ANGELS T-LIGHT HLDR,2.55
ASSORTED COLOUR BIRD ORNAMENT,1.69
ANTIQUE SILVER TEA GLASS ETCHED,1.25
WHITE HANGING HEART T-LIGHT HOLDER,2.95
LARGE HANGING IVORY & RED WOOD BIRD,0.65
PORCELAIN T-LIGHT HOLDERS ASSORTED,1.25
SWISS CHALET TREE DECORATION ,0.85
DARK BIRD HOUSE TREE DECORATION,0.85
PAINTED METAL PEARS ASSORTED,1.69
IVORY HANGING DECORATION  HEART,0.85
FILIGRIS HEART WITH BUTTERFLY,1.25
CHICK GREY HOT WATER BOTTLE,3.45
RED SPOT HEART HOT WATER BOTTLE,4.95
RED HANGING METAL STAR TLIGHT HLDR,3.75
RED HANGING HEART T-LIGHT HOLDER,2.95
HOME BUILDING BLOCK WORD,5.95
BATH BUILDING BLOCK WORD,5.95
CHRISTMAS HANGING TREE WITH BELL,1.25
HEART T-LIGHT HOLDER ,1.45
EMPIRE BIRTHDAY CARD,0.42
BANQUET BIRTHDAY  CARD  ,0.42
TEA PARTY BIRTHDAY CARD,0.42
SPACE BOY BIRTHDAY CARD,0.42
SWALLOWS GREETING CARD,0.42
VINTAGE CARAVAN GREETING CARD ,0.42
 VINTAGE DESIGN GIFT TAGS,0.85
ROTATING LEAVES T-LIGHT HOLDER,2.55
"ELEPHANT, BIRTHDAY CARD, ",0.42
GIN & TONIC DIET GREETING CARD ,0.42
WHITE ROUND PORCELAIN TLIGHT HOLDER,2.55
EDWARDIAN PARASOL RED,5.95
CHRISTMAS CARD SINGING ANGEL,0.42
PAPER CHAIN KIT 50'S CHRISTMAS ,2.95
BIRD HOUSE HOT WATER BOTTLE,3.45
JOY WOODEN BLOCK LETTERS,4.95
 PEACE WOODEN BLOCK LETTERS,6.95
NOEL WOODEN BLOCK LETTERS ,5.95
PARTY CONE CHRISTMAS DECORATION ,0.85
CHRISTMAS CRAFT WHITE FAIRY ,1.45
CHRISTMAS CRAFT HEART STOCKING ,2.1
PLACE SETTING WHITE HEART,0.42
FREESTYLE CANVAS ART PICTURE,4.25
MANHATTAN CANVAS ART PICTURE,12.75
SMALL GLASS HEART TRINKET POT,1.85
LUNCHBOX WITH CUTLERY FAIRY CAKES ,2.55
HAND OVER THE CHOCOLATE   SIGN ,2.1
JAPANESE CROCHETED ANIMAL,0.42
"FANCY FONT BIRTHDAY CARD, ",0.42
SET OF 36 TEATIME PAPER DOILIES,1.45
PACK OF 20 FAIRY CAKE PAPER NAPKINS,0.85
TEA TIME DES TEA COSY,2.55
CERAMIC CAKE DESIGN SPOTTED MUG,1.49
PINK JUMPER LARRY THE LAMB,2.1
HOT WATER BOTTLE TEA AND SYMPATHY,3.95
CERAMIC CAKE BOWL + HANGING CAKES,2.95
SILVER/CRYSTAL DROP EARRINGS W LEAF,2.95
REX CASH+CARRY JUMBO SHOPPER,0.95
CREAM SLICE FLANNEL PINK SPOT ,2.95
HOT WATER BOTTLE TEA AND SYMPATHY,3.95
JAPANESE CROCHETED ANIMAL,0.42
FLOWER VINE RAFFIA FOOD COVER,3.75
RED WOOLLY HOTTIE WHITE HEART.,3.75
12 PENCILS TALL TUBE SKULLS,0.85
12 PENCILS TALL TUBE RED SPOTTY,0.85
SET/20 RED SPOTTY PAPER NAPKINS ,0.85
LUNCH BAG CARS BLUE,1.65
PACK 20 ENGLISH ROSE PAPER NAPKINS,0.85
SINGLE HEART ZINC T-LIGHT HOLDER,0.95
HANGING HEART ZINC T-LIGHT HOLDER,0.85
SET OF 72 PINK HEART PAPER DOILIES,1.45
JUMBO BAG RED WHITE SPOTTY ,1.95
WHITE HANGING HEART T-LIGHT HOLDER,2.95
WEEKEND BAG VINTAGE ROSE PAISLEY,8.5
WASH BAG VINTAGE ROSE PAISLEY,2.55
OVERNIGHT BAG VINTAGE ROSE PAISLEY,4.95
"CHARLOTTE BAG , SUKI DESIGN",0.85
RED HANGING HEART T-LIGHT HOLDER,2.95
FAIRY CAKE FLANNEL ASSORTED COLOUR,2.55
SET OF 72 RETRO SPOT PAPER  DOILIES,1.45
WHITE SKULL HOT WATER BOTTLE ,3.75
JUMBO STORAGE BAG SKULLS,1.95
JUMBO STORAGE BAG SUKI,1.95
GRAND CHOCOLATECANDLE,1.45
FAIRY CAKE CANDLES,1.49
PINK BLUE FELT CRAFT TRINKET BOX,1.06
ROSES ON BLUE TEACUP CANDLE ,1.69
KNITTED UNION FLAG HOT WATER BOTTLE,3.75
PINK HEART SHAPE EGG FRYING PAN,1.65
"DECOUPAGE,GREETING CARD,",0.42
ASSTD DESIGN BUBBLE GUM RING,0.21
CREAM CUPID HEARTS COAT HANGER,3.25
SET OF 4 FAIRY CAKES COASTERS ,1.25
PACK OF 20 FAIRY CAKE PAPER NAPKINS,0.85
ASSORTED COLOUR BIRD ORNAMENT,1.69
ANTIQUE SILVER TEA GLASS ETCHED,1.25
ANTIQUE SILVER TEA GLASS ENGRAVED,1.25
SMALL HEART FLOWERS HOOK ,0.85
SET OF 36 TEATIME PAPER DOILIES,1.45
SET OF 72 PINK HEART PAPER DOILIES,1.45
60 TEATIME FAIRY CAKE CASES,0.55
WHITE HANGING HEART T-LIGHT HOLDER,2.95
LADIES & GENTLEMEN METAL SIGN,2.55
S/4 VALENTINE DECOUPAGE HEART BOX,2.95
SET/3 RUSSIAN DOLL STACKING TINS,4.95
COLOURING PENCILS BROWN TUBE,1.25
EDWARDIAN PARASOL BLACK,5.95
EDWARDIAN PARASOL NATURAL,5.95
EDWARDIAN PARASOL RED,5.95
GLITTER BUTTERFLY CLIPS,2.55
GEISHA GIRL CHOPSTICKS SET/5,1.95
SPRING FLOWER CHOPSTICKS SET/5,1.95
SWEETHEART CERAMIC TRINKET BOX,1.25
STRAWBERRY CERAMIC TRINKET BOX,1.25
AGED GLASS SILVER T-LIGHT HOLDER,0.65
FILIGRIS HEART WITH BUTTERFLY,1.25
RED GINGHAM ROSE JEWELLERY BOX,1.65
SET/3 RED GINGHAM ROSE STORAGE BOX,3.75
RED SPOT HEART HOT WATER BOTTLE,4.95
PINK HEART DOTS HOT WATER BOTTLE,3.75
RED WHITE SCARF  HOT WATER BOTTLE,3.95
PACK OF 60 PINK PAISLEY CAKE CASES,0.55
MINI CAKE STAND  HANGING STRAWBERY,1.65
CERAMIC PLATE STRAWBERRY DESIGN,1.49
CERAMIC STRWBERRY DESIGN MUG,1.49
LARGE CAKE STAND  HANGING STRAWBERY,9.95
CERAMIC BOWL WITH STRAWBERRY DESIGN,2.95
COLOURING PENCILS BROWN TUBE,0.85
COLOURING PENCILS BROWN TUBE,1.25
SCOTTIE DOG HOT WATER BOTTLE,4.95
METAL 4 HOOK HANGER FRENCH CHATEAU,2.95
VICTORIAN GLASS HANGING T-LIGHT,1.25
CREAM HEART CARD HOLDER,3.95
FOUR HOOK  WHITE LOVEBIRDS,2.1
CAKE STAND LOVEBIRD 2 TIER WHITE,9.95
HEART FILIGREE DOVE  SMALL,1.25
MINI CAKE STAND WITH HANGING CAKES,1.45
CERAMIC CAKE DESIGN SPOTTED PLATE,1.49
CERAMIC CAKE DESIGN SPOTTED MUG,1.49
CERAMIC CAKE STAND + HANGING CAKES,9.95
TEA TIME TEA SET IN GIFT BOX,6.95
TEA TIME MUG IN GIFT BOX,2.95
FAIRY CAKE CANDLES,1.49
CHILLI LIGHTS,4.95
GREEN CHERRY LIGHTS,6.75
LIGHT PINK CHERRY LIGHTS,6.75
PINK CHERRY LIGHTS,6.75
WOODEN PICTURE FRAME WHITE FINISH,2.55
WOOD 2 DRAWER CABINET WHITE FINISH,5.95
WOOD S/3 CABINET ANT WHITE FINISH,7.95
WOODEN FRAME ANTIQUE WHITE ,2.95
WOOD 2 DRAWER CABINET WHITE FINISH,5.95
WOODEN PICTURE FRAME WHITE FINISH,2.55
SET/6 CHRISTMAS ICICLE T-LIGHTS,1.25
RED SPOTTY ROUND CAKE TINS,9.95
IVORY PILLAR CANDLE SILVER FLOCK,2.95
FAIRY CAKE CANDLES,1.49
WOOD S/3 CABINET ANT WHITE FINISH,7.95
SWEETHEART KEY CABINET,6.75
BROWN FURRY HOT WATER BOTTLE,3.75
VICTORIAN SEWING BOX MEDIUM,7.95
4 IVORY DINNER CANDLES SILVER FLOCK,2.55
BAKING SET 9 PIECE RETROSPOT ,4.95
LUNCH BAG WOODLAND,1.65
GOLD MINI TAPE MEASURE ,0.85
PINK MINI TAPE MEASURE ,0.85
SILVER MINI TAPE MEASURE ,0.85
PACK/12 RUSSIAN DOLL CARDS,2.95
PINK KNITTED COW STUFFED TOY,3.75
DOG TOY WITH PINK CROCHET SKIRT,3.75
SILVER TEDDY BEAR,3.75
GOLD TEDDY BEAR,3.75
CAMOFLAGE DESIGN TEDDY,2.55
PINK JUMPER LARRY THE LAMB,2.1
FAIRY CAKE CANDLES,1.49
VIPPASSPORT COVER ,2.1
PINK PILLAR CANDLE SILVER FLOCK,2.95
IVORY PILLAR CANDLE SILVER FLOCK,2.95
FAWN BLUE HOT WATER BOTTLE,2.95
 SILVER T-LIGHT SETTING,6.75
DARK PINK FLOCK GLASS CANDLEHOLDER,1.65
LIGHT PINK FLOCK GLASS CANDLEHOLDER,1.65
GIRLY PINK TOOL SET,4.95
BLOKEY SILVER TOOL SET,4.95
FAWN BLUE HOT WATER BOTTLE,2.95
KNITTED UNION FLAG HOT WATER BOTTLE,3.75
RED WOOLLY HOTTIE WHITE HEART.,3.75
RED WHITE SCARF  HOT WATER BOTTLE,3.95
CHARLIE + LOLA RED HOT WATER BOTTLE,2.95
ROBOT BIRTHDAY CARD,0.42
SWALLOWS GREETING CARD,0.42
VINTAGE KID DOLLY CARD ,0.42
"FANCY FONT BIRTHDAY CARD, ",0.42
SWALLOW CIGAR BOX MATCHES ,1.25
RETRO SPOT  CIGAR BOX MATCHES ,1.25
KINGS CHOICE CIGAR BOX MATCHES ,1.25
JUMBO STORAGE BAG SUKI,1.95
SUKI  SHOULDER BAG,1.65
RETRO SPOT GIANT  TUBE MATCHES,2.55
COSY HOUR GIANT TUBE MATCHES,2.55
POTTING SHED TEA MUG,1.25
METAL MEDINA LANTERN ,12.75
SILVER VANILLA FLOWER CANDLE POT,3.75
SILVER LATTICE VANILLA CANDLE POT,3.75
GRAND CHOCOLATECANDLE,1.45
MOROCCAN TEA GLASS,0.85
GLASS BONBON JAR PARFUME AUX FLEURE,1.25
ANT WHITE WIRE HEART SPIRAL,3.95
HANGING MEDINA LANTERN LARGE,4.25
HANGING MEDINA LANTERN SMALL,2.95
KASBAH LANTERN WITH GLASS ,4.65
SILVER PLATE CANDLE BOWL LARGE,3.75
PINK SPOTS CHOCOLATE NESTING BOXES ,2.95
WOODEN HAPPY BIRTHDAY GARLAND,2.95
PINK STRIPE HOT WATER BOTTLE,2.95
RETRO SPOTS PUDDING BOWL,4.25
BUTTERFLY WATER TRANSFER TATTOOS ,0.85
SKULLS  WATER TRANSFER TATTOOS ,0.85
GLASS CAKE COVER AND PLATE,16.95
ASSTD DESIGN POP ART SLIM PEN,0.85
SILVER HANGING T-LIGHT HOLDER,1.65
BLACK/BLUE DOTS RUFFLED UMBRELLA,5.95
RED/WHITE DOTS RUFFLED UMBRELLA,5.95
ANTIQUE LILY FAIRY LIGHTS,4.95
CANDY SPOT APRON,4.65
JUMBO  BAG BAROQUE BLACK WHITE,1.95
CHARLIE AND LOLA FIGURES TINS,9.95
EDWARDIAN PARASOL NATURAL,5.95
EDWARDIAN PARASOL RED,5.95
DOLLY MIXTURE CHILDREN'S UMBRELLA,3.25
RETRO PINK SPOT WASHING UP GLOVES,2.1
RETRO RED SPOTTY WASHING UP GLOVES,2.1
12 PENCILS TALL TUBE RED SPOTTY,0.85
RED SPOTTY OVEN GLOVE DOUBLE,2.95
NURSE'S BAG SOFT TOY,8.95
TOOL BOX SOFT TOY ,8.95
HOME SWEET HOME METAL SIGN ,2.95
STRAWBERRY CERAMIC TRINKET BOX,1.25
VICTORIAN SEWING BOX LARGE,12.75
STRIPEY CHOCOLATE NESTING BOXES,2.95
CHARLIE+LOLA RED HOT WATER BOTTLE ,4.65
CHARLIE LOLA BLUE HOT WATER BOTTLE ,4.65
WORLD WAR 2 GLIDERS ASSTD DESIGNS,0.21
3D DOG PICTURE PLAYING CARDS,2.95
CHILLI LIGHTS,4.95
PINK CHERRY LIGHTS,6.75
 SILVER CHERRY LIGHTS,6.75
 WHITE CHERRY LIGHTS,6.75
FAIRY CAKE CANDLES,1.49
COLOURING PENCILS BROWN TUBE,0.85
EDWARDIAN PARASOL BLACK,5.95
"FOLDING UMBRELLA , RED/WHITE SPOT",4.95
"FOLDING UMBRELLA , BLACK/BLUE  SPOT",4.95
FOLDING UMBRELLA  CREAM/MULTI  SPOT,4.95
FOLDING UMBRELLA  PINK/WHITE  SPOT,4.95
FOLDING UMBRELLA  WHITE/RED  SPOT,4.95
COSY SLIPPER SHOES SMALL  RED ,2.95
COSY SLIPPER SHOES SMALL GREEN,2.95
COSY SLIPPER SHOES LARGE RED,2.95
COSY SLIPPER SHOES LARGE GREEN,2.95
GLASS CAKE STAND MIRRORED BASE,14.95
VINTAGE SNAP CARDS,0.85
VINTAGE HEADS AND TAILS CARD GAME ,1.25
KINGS CHOICE MUG,1.25
VINTAGE SNAKES & LADDERS,3.75
SET 12 KIDS COLOUR  CHALK STICKS,0.42
EMPIRE TISSUE BOX,1.25
BOUDOIR SQUARE TISSUE BOX,1.25
METAL SIGN EMPIRE TEA,2.95
RETRO SPOT TEA SET CERAMIC 11 PC ,4.95
TEA COSY RED  STRIPE,2.55
LUNCHBOX WITH CUTLERY RETROSPOT ,2.55
MINATURE COLOURED GARDENING SET,4.95
ENGLISH ROSE IRONING BOARD COVER,3.75
BLUE HAPPY BIRTHDAY BUNTING,5.45
HEN HOUSE DECORATION,1.65
WORLD WAR 2 GLIDERS ASSTD DESIGNS,0.21
DOOR MAT FRIENDSHIP ,6.75
BLUE HARMONICA IN BOX ,1.25
PINK SPOTTY CHILDS UMBRELLA,3.25
RED SPOTTY CHILDS UMBRELLA,3.25
"FOLDING UMBRELLA , RED/WHITE SPOT",4.95
FOLDING UMBRELLA  PINK/WHITE  SPOT,4.95
FOLDING UMBRELLA  CREAM/MULTI  SPOT,4.95
"FOLDING UMBRELLA , BLACK/BLUE  SPOT",4.95
FOLDING UMBRELLA  CHOC/WHITE  SPOT,4.95
MAGIC SHEEP WOOL GROWING FROM PAPER,2.55
BABY MOUSE RED GINGHAM DRESS,4.25
MUMMY MOUSE RED GINGHAM RIBBON,5.45
POTTING SHED CANDLE CITRONELLA,2.95
POTTING SHED TWINE,2.1
BLUE SHARK HELICOPTER,7.95
POTTING SHED SOW 'N' GROW SET,4.25
POTTING SHED SEED TIN,4.25
BLUE FAIRY CAKE CHILD'S APRON,1.95
RED SPOTTY CHILDS APRON,1.95
VINTAGE UNION JACK BUNTING,8.5
GLASS HONEYPOT WASP CATCHER,1.95
SET/6 GARDEN GNOME T-LIGHT CANDLES,2.95
"SPRING DEC , HANGING CHICK CREAM",1.45
BATH DUCK WATERING CAN,2.95
PINK B'FLY C/COVER W BOBBLES,5.95
"KEY FOB , FRONT  DOOR ",0.65
"KEY FOB , BACK DOOR ",0.65
"KEY FOB , SHED",0.65
HAND OVER THE CHOCOLATE   SIGN ,2.1
COOK WITH WINE METAL SIGN ,1.95
GARDEN METAL SIGN ,1.65
PARTY METAL SIGN ,1.45
WAY OUT METAL SIGN ,1.65
CHOCOLATE THIS WAY METAL SIGN,2.1
TOILET METAL SIGN,0.55
KITCHEN METAL SIGN,0.55
BATHROOM METAL SIGN,0.55
BEWARE OF THE CAT METAL SIGN ,1.69
HOT BATHS METAL SIGN,2.1
POTTERING IN THE SHED METAL SIGN,1.95
"FRENCH BOTTLE , LAVENDER",1.65
BROWN CHECK CAT DOORSTOP ,4.25
WHITE HANGING HEART T-LIGHT HOLDER,2.95
RED HANGING HEART T-LIGHT HOLDER,2.95
RED GINGHAM ROSE JEWELLERY BOX,1.65
WOOD STAMP SET THANK YOU,1.65
PAINTED METAL PEARS ASSORTED,1.69
POTTING SHED TEA MUG,1.25
TEA COSY BLUE STRIPE,2.55
IVORY HANGING DECORATION  BIRD,0.85
IVORY HANGING DECORATION  BUTTERFLY,0.85
IVORY HANGING DECORATION  HEART,0.85
FILIGRIS HEART WITH BUTTERFLY,1.25
RETRO SPOT TEA SET CERAMIC 11 PC ,4.95
SET/6 TURQUOISE BUTTERFLY T-LIGHTS,2.1
VIP LUGGAGE TAG ,1.25
VIPPASSPORT COVER ,2.1
PINK UNION JACK  LUGGAGE TAG,1.25
UNION JACK FLAG LUGGAGE TAG,1.25
RED HANGING METAL STAR TLIGHT HLDR,3.75
PINK UNION JACK  PASSPORT COVER ,2.1
UNION JACK FLAG PASSPORT COVER ,2.1
ENGLISH ROSE IRONING BOARD COVER,3.75
RED SPOT HEART HOT WATER BOTTLE,4.95
RED WOOLLY HOTTIE WHITE HEART.,3.75
KNITTED UNION FLAG HOT WATER BOTTLE,3.75
TOAST ITS - HAPPY BIRTHDAY,1.25
TOAST ITS - DINOSAUR,1.25
TOAST ITS - I LOVE YOU ,1.25
TOAST ITS - FAIRY FLOWER,1.25
TOAST ITS - BEST MUM,1.25
 SILVER T-LIGHT SETTING,6.75
WRAP BLUE REINDEER,0.42
WHITE SKULL HOT WATER BOTTLE ,3.75
RED SPOTTY APRON ,5.95
SET/2 RED SPOTTY TEA TOWELS ,2.95
BAKING SET 9 PIECE RETROSPOT ,4.95
36 PENCILS TUBE SKULLS,1.25
36 PENCILS TUBE RED SPOTTY,1.25
OVERNIGHT BAG VINTAGE ROSE PAISLEY,4.95
ENGLISH ROSE DESIGN PEG BAG,2.1
URBAN CHIC CHOPSTICKS SET/5,1.95
SPRING FLOWER CHOPSTICKS SET/5,1.95
PACK OF 72 SKULL CAKE CASES,0.55
GLASS  BEURRE DISH,3.95
PACK OF 60 PINK PAISLEY CAKE CASES,0.55
SET OF 3 SILVER FLYING DUCKS,6.35
60 TEATIME FAIRY CAKE CASES,0.55
IVORY ENCHANTED FOREST PLACEMAT,1.65
RED SPOTTY ROUND CAKE TINS,9.95
WELCOME  WOODEN BLOCK LETTERS,9.95
HOME BUILDING BLOCK WORD,5.95
GREEN MINI TAPE MEASURE ,0.85
12 PENCILS SMALL TUBE RED SPOTTY,0.65
12 PENCILS SMALL TUBE POSY,0.65
SET/20 RED SPOTTY PAPER NAPKINS ,0.85
RETRO SPOT TRADITIONAL TEAPOT ,7.95
RETRO SPOT SUGAR JAM BOWL,2.55
CERAMIC STRAWBERRY MONEY BOX,2.55
BIG DOUGHNUT FRIDGE MAGNETS,0.85
RECIPE BOX WITH METAL HEART,7.95
SET 12 RETRO WHITE CHALK STICKS,0.42
PACK OF 12 RED SPOTTY TISSUES ,0.29
PACK OF 12 HEARTS DESIGN TISSUES ,0.29
TEA CUP AND SAUCER RETRO SPOT,3.75
NOEL WOODEN BLOCK LETTERS ,5.95
BAKING SET 9 PIECE RETROSPOT ,4.95
ENGLISH ROSE TAPE MEASURE,1.25
VINTAGE CREAM 3 BASKET CAKE STAND,9.95
SET OF 4 ENGLISH ROSE COASTERS,1.25
SET OF 4 FAIRY CAKES COASTERS ,1.25
PINK SMALL GLASS CAKE STAND,1.95
RED SPOTTY CHILDS UMBRELLA,3.25
PINK SPOTTY CHILDS UMBRELLA,3.25
SCOTTIE DOG HOT WATER BOTTLE,4.95
LUNCHBOX WITH CUTLERY FAIRY CAKES ,2.55
SKULL LUNCHBOX WITH CUTLERY ,2.55
DINOSAUR LUNCHBOX WITH CUTLERY,2.55
STRAWBERRY LUNCHBOX WITH CUTLERY,2.55
WEEKEND BAG VINTAGE ROSE PAISLEY,8.5
ASSORTED COLOURS SILK FAN,0.48
SMALL CHINESE STYLE SCISSOR,0.32
MEDIUM CHINESE STYLE SCISSOR,0.36
LARGE CHINESE STYLE SCISSOR,0.72
BUDDHA INCENSE HOLDER ASSORTED,0.67
PACK OF 72 RETRO SPOT CAKE CASES,0.55
RED SPOTTY ROUND CAKE TINS,9.95
PINK STRIPE HOT WATER BOTTLE,2.95
VINTAGE UNION JACK BUNTING,8.5
RED STRIPE CERAMIC DRAWER KNOB,1.25
BLUE STRIPE CERAMIC DRAWER KNOB,1.25
WHITE SPOT RED CERAMIC DRAWER KNOB,1.25
WHITE SPOT BLUE CERAMIC DRAWER KNOB,1.25
RETRO SPOT CAKE STAND,10.95
TEA PARTY  WRAPPING PAPER ,0.42
EMPIRE GIFT WRAP,0.42
CHOCOLATE HOT WATER BOTTLE,4.95
GREY HEART HOT WATER BOTTLE,3.45
HOT WATER BOTTLE TEA AND SYMPATHY,3.95
PICTURE FRAME WOOD TRIPLE PORTRAIT,6.75
CREAM HEART CARD HOLDER,3.95
TEA COSY RED  STRIPE,2.55
SILVER CHRISTMAS TREE BAUBLE STAND ,16.95
PINK SMALL GLASS CAKE STAND,1.95
WHITE HANGING HEART T-LIGHT HOLDER,2.95
SET 3 WICKER LOG BASKETS,19.95
TEA BAG PLATE RED SPOTTY ,0.85
EMBROIDERED REINDEER DECORATION,2.12
JAPANESE CROCHETED ANIMAL,0.42
WHITE ADVENT CANDLE,2.12
S/4 BURGUNDY WINE DINNER CANDLES,1.25
S/4 FESTIVE RED DINNER CANDLES,1.25
WOODEN PICTURE FRAME WHITE FINISH,2.55
TRADITIONAL CHRISTMAS RIBBONS,1.25
CINAMMON & ORANGE WREATH,6.75
12 IVORY ROSE PEG PLACE SETTINGS,1.25
"KEY FOB , BACK DOOR ",0.65
"KEY FOB , FRONT  DOOR ",0.65
"KEY FOB , GARAGE DESIGN",0.65
"KEY FOB , SHED",0.65
WHITE BEADED GARLAND STRING 20LIGHT,6.35
PARTY CONE CHRISTMAS DECORATION ,0.85
PAINTED METAL TREE WITH HOLLY BELLS,1.45
WHITE BELL HONEYCOMB PAPER GARLAND ,1.65
CROCHET BEAR WITH BLUE STRIPES,2.55
COSY SLIPPER SHOES LARGE RED,2.95
PREMIUM CHURCH CANDLE,2.1
S/4 FESTIVE GREEN DINNER CANDLES,1.25
COSY SLIPPER SHOES LARGE GREEN,2.95
12 IVORY ROSE PEG PLACE SETTINGS,1.25
BROWN CHECK CAT DOORSTOP ,4.25
BROWN CHECK CAT DOORSTOP ,4.25
WHITE HANGING HEART T-LIGHT HOLDER,2.95
LARGE ROUND CUTGLASS CANDLESTICK,6.75
IVORY HANGING BIRD PLANTER ,2.55
GREY HEART HOT WATER BOTTLE,3.45
RED GINGHAM ROSE JEWELLERY BOX,1.65
12 RED ROSE PEG PLACE SETTINGS,1.25
FUNKY WASHING UP GLOVES ASSORTED,2.1
GIN + TONIC DIET METAL SIGN,2.1
RED SPOTTY CUP,0.85
GREEN SPOTTY CUP,0.85
RED SPOTTY PLATE ,1.69
GREEN  SPOTTY PLATE ,1.69
PORCELAIN ROSE SMALL,0.85
CHICK GREY HOT WATER BOTTLE,3.45
DAIRY MAID CERAMIC BUTTER DISH,4.25
KINGS CHOICE CIGAR BOX MATCHES ,1.25
SET OF 12 LILY BOTANICAL T-LIGHTS,2.95
HANGING GLASS ETCHED TEALIGHT,1.65
GLAMOROUS  MUG,1.25
CAKE STAND WHITE TWO TIER LACE,8.5
POLYESTER FILLER PAD 65CMx65CM,4.25
POLYESTER FILLER PAD 40x40cm,1.45
HOT BATHS METAL SIGN,2.1
BLUE GINGHAM ROSE CUSHION COVER,5.95
RED ROSE AND LACE C/COVER,2.95
LADIES & GENTLEMEN METAL SIGN,2.55
TOILET METAL SIGN,0.55
FIRST AID TIN,3.25
BLUE PAISLEY NOTEBOOK,1.65
GREEN FERN NOTEBOOK,1.65
STRING OF STARS CARD HOLDER,2.95
MEDIUM MEDINA STAMPED METAL BOWL ,2.95
SMALL MEDINA STAMPED METAL BOWL ,0.85
COLOURING PENCILS BROWN TUBE,1.25
GLASS  BEURRE DISH,3.95
RIDGED GLASS STORAGE JAR CREAM LID,3.75
DOOR MAT BLACK FLOCK ,6.75
SKULLS DESIGN FLANNEL,0.85
CERAMIC CAKE DESIGN SPOTTED MUG,1.49
CHOC TRUFFLE GOLD TRINKET POT ,1.65
CERAMIC STRWBERRY DESIGN MUG,1.49
CREAM HEART CARD HOLDER,3.95
 BLACK PIRATE TREASURE CHEST,1.65
SWEETHEART CERAMIC TRINKET BOX,1.25
SWEETHEART CERAMIC TRINKET BOX,1.25
STRAWBERRY CERAMIC TRINKET BOX,1.25
JELLY BABIES YELLOW SMALL BOWL,1.25
POTTING SHED TEA MUG,1.25
MINI CAKE STAND HANGING HEARTS,1.65
POTTERING MUG,1.25
LARGE TORTILLA DESIGN RED BOWL,3.75
ROBOT MUG IN DISPLAY BOX,1.25
LUNCH BAG CARS BLUE,1.65
PINK FAIRY CAKE CHILD'S APRON,1.95
BLUE FAIRY CAKE CHILD'S APRON,1.95
TOOL BOX SOFT TOY ,8.95
"FEATHER DUSTER, COAL BLACK",1.25
"FEATHER DUSTER, LIGHT PINK",1.25
MINI CAKE STAND  HANGING STRAWBERY,1.65
DAISY ERASERS IN BAG,0.42
RED FLORAL FELTCRAFT SHOULDER BAG,3.75
PINK FLORAL FELTCRAFT SHOULDER BAG,3.75
PINK BLUE FELT CRAFT TRINKET BOX,1.25
PINK CREAM FELT CRAFT TRINKET BOX ,1.25
TRADITIONAL WOODEN SKIPPING ROPE,1.25
SET 12 KIDS  WHITE CHALK STICKS,0.42
SET 12 KIDS COLOUR  CHALK STICKS,0.42
 3 STRIPEY MICE FELTCRAFT,1.95
FELTCRAFT DOLL ROSIE,2.95
FELTCRAFT DOLL MOLLY,2.95
ASSTD DESIGN BUBBLE GUM RING,0.21
COFFEE MUG DOG + BALL DESIGN,2.55
COFFEE MUG CAT + BIRD DESIGN,2.55
COFFEE MUG PEARS  DESIGN,2.55
COFFEE MUG APPLES DESIGN,2.55
POSTAGE,2.99
FELT FARM ANIMAL RABBIT,1.25
ASSORTED COLOUR JUMBO PEN,0.42
12 PENCILS SMALL TUBE RED SPOTTY,0.65
DINOSAURS WATER TRANSFER TATTOOS ,0.85
WOODLAND WATER TRANSFER TATTOOS ,0.85
SKULLS  WATER TRANSFER TATTOOS ,0.85
BUTTERFLY WATER TRANSFER TATTOOS ,0.85
SET/4 SKULL BADGES,1.25
12 PENCILS SMALL TUBE SKULL,0.65
HEART DECORATION PAINTED ZINC ,0.65
GLITTER CHRISTMAS HEART ,0.85
HEART IVORY TRELLIS LARGE,1.65
3 HEARTS HANGING DECORATION RUSTIC,2.95
GLITTER STAR GARLAND WITH BELLS ,3.75
PINK CREAM FELT CRAFT TRINKET BOX ,1.25
WOODEN FRAME ANTIQUE WHITE ,2.95
WOODEN PICTURE FRAME WHITE FINISH,2.55
CLASSIC WHITE FRAME,2.95
STRIPES DESIGN MONKEY DOLL,2.55
HEART SHAPE WIRELESS DOORBELL,2.1
ANTIQUE SILVER TEA GLASS ETCHED,1.25
SILVER SLEIGHBELL  WREATH,7.95
VINTAGE SNAP CARDS,0.85
VINTAGE HEADS AND TAILS CARD GAME ,1.25
SET OF THREE 50'S GIFT WRAPS ,1.95
SET OF THREE VINTAGE GIFT WRAPS,1.95
WHITE GRAND BAROQUE PHOTO FRAME,4.25
GOLD COSMETIC BAG PINK STAR,2.1
UNION JACK HOT WATER BOTTLE ,5.95
CROSS STITCH ALPHABET CUSHION COVER,5.95
POLYESTER FILLER PAD 45x45cm,1.55
HOT WATER BOTTLE TEA AND SYMPATHY,3.95
CHOCOLATE HOT WATER BOTTLE,4.95
WHITE SKULL HOT WATER BOTTLE ,3.75
PACK OF 20 SKULL PAPER NAPKINS,0.85
SET/20 RED SPOTTY PAPER NAPKINS ,0.85
SET OF 2 FANCY FONT TEA TOWELS,2.95
RIDGED GLASS POSY VASE ,1.45
HEART IVORY TRELLIS LARGE,1.65
HAIRCLIPS FORTIES FABRIC ASSORTED,0.65
GREY HEART HOT WATER BOTTLE,3.45
CLASSICAL ROSE URN,7.95
CHRISTMAS CRAFT WHITE FAIRY ,1.45
FELTCRAFT 6 FLOWER FRIENDS,2.1
"FEATHER DUSTER, LIGHT PINK",1.25
HEART EAR MUFF HEADPHONES,5.49
CREAM CUPID HEARTS COAT HANGER,3.25
METAL 4 HOOK HANGER FRENCH CHATEAU,2.95
WHITE DOVE HONEYCOMB PAPER GARLAND,1.45
POSTAGE,18
SET/6 STRAWBERRY PAPER PLATES,0.85
SET/6 STRAWBERRY PAPER CUPS,0.65
SET/6 RED SPOTTY PAPER PLATES,0.85
SET/20 RED SPOTTY PAPER NAPKINS ,0.85
SET/6 RED SPOTTY PAPER CUPS,0.65
SET/10 RED SPOTTY PARTY CANDLES,1.25
LUNCHBOX WITH CUTLERY RETROSPOT ,2.55
