Description,Price
COLOURING PENCILS BROWN TUBE,1.25
RED SPOT HEART HOT WATER BOTTLE,4.95
CHOCOLATE HOT WATER BOTTLE,4.95
SCOTTIE DOG HOT WATER BOTTLE,4.95
HOT WATER BOTTLE TEA AND SYMPATHY,3.95
RED WOOLLY HOTTIE WHITE HEART.,3.75
KNITTED UNION FLAG HOT WATER BOTTLE,3.75
WHITE SKULL HOT WATER BOTTLE ,3.75
36 PENCILS TUBE RED SPOTTY,1.25
72 SWEETHEART FAIRY CAKE CASES,0.55
VICTORIAN GLASS HANGING T-LIGHT,1.25
JUMBO BAG RED WHITE SPOTTY ,1.95
JUMBO BAG WOODLAND ANIMALS,1.95
JUMBO BAG OWLS,1.95
TEA BAG PLATE RED SPOTTY ,0.85
RED SPOTS  WRAP ,0.42
BLUE SPOTS  WRAP,0.42
S/4 IVORY MINI ROSE CANDLE IN BOWL,1.65
BLUE TILED TRAY,6.75
METAL 4 HOOK HANGER FRENCH CHATEAU,2.95
EIGHT PIECE SNAKE  SET,1.25
EIGHT PIECE CREEPY CRAWLIE SET,1.25
RETRO SPOT GIANT  TUBE MATCHES,2.55
CLASSIC WHITE FRAME,2.95
CURIOUS IMAGES SCRAP BOOK SET,4.95
4 VANILLA BOTANICAL CANDLES,3.75
RETRO SPOT PADDED SEAT CUSHION,3.75
HEART SHAPE WIRELESS DOORBELL,2.1
RED SPOTTY PASSPORT COVER,2.1
BLACK SMALL GLASS CAKE STAND,1.95
RED SPOTTY BISCUIT TIN,3.75
SILVER ROCOCO CANDELABRA,12.75
TEATIME CAKE TIN WITH HANDLE,9.95
JUMBO BAG RED WHITE SPOTTY ,1.95
CHARLIE AND LOLA CHARLOTTE BAG,1.65
SUKI  SHOULDER BAG,1.65
LUNCH BAG  BLACK SKULL.,1.65
"CHARLOTTE BAG , PINK/WHITE SPOTS",0.85
RED SPOTTY CHARLOTTE BAG,0.85
LUNCH BAG RED SPOTTY,1.65
STRAWBERRY CHARLOTTE BAG,0.85
"CHARLOTTE BAG , SUKI DESIGN",0.85
PICCADILLY TEA SET,14.95
PINK DIAMANTE PEN IN GIFT BOX,4.95
4 IVORY DINNER CANDLES SILVER FLOCK,2.55
S/4 BLACK DINNER CANDLE SILVER FLOC,2.55
SET OF 3 BIRD L.BLUE FEATHER,1.25
ENGLISH ROSE TORCH,1.65
PAPER CHAIN KIT RETRO SPOT,2.95
PAPER CHAIN KIT 50'S CHRISTMAS ,2.95
TRADITIONAL CHRISTMAS RIBBONS,1.25
FRYING PAN PINK POLKADOT ,4.25
MILK PAN PINK RETROSPOT,3.75
EDWARDIAN TOILET ROLL UNIT ,12.75
HOT WATER BOTTLE TEA AND SYMPATHY,3.95
SET/2 RED SPOTTY TEA TOWELS ,2.95
WHITE SKULL HOT WATER BOTTLE ,3.75
SKULLS WRITING SET ,1.65
RETRO LONGBOARD IRONING BOARD COVER,3.75
CACTI T-LIGHT CANDLES,0.42
PLEASE ONE PERSON  METAL SIGN,2.1
POTTERING IN THE SHED METAL SIGN,1.95
S/3 TEAR DROP CUT GLASS DECORATION,1.25
RED SPOTTY CANDY BAG,1.25
JUMBO STORAGE BAG SKULLS,1.95
RETRO PLASTIC POLKA TRAY,0.42
SCANDINAVIAN REDS RIBBONS,1.25
RED SPOTTY PEG BAG,2.1
BLUE FAIRY CAKE CHILD'S APRON,1.95
GREEN ROSE WASHBAG,3.75
HEART EAR MUFF HEADPHONES,5.49
I CAN ONLY PLEASE ONE PERSON MUG,1.25
SET OF 6 FUNKY BEAKERS,2.95
SET OF RED SALAD SERVERS ,1.49
BLACK EAR MUFF HEADPHONES,5.49
BROWN FURRY HOT WATER BOTTLE,3.75
SMALLFOLKART BAUBLE CHRISTMAS DEC,0.42
VINTAGE PINK TINSEL REEL ,2.1
CURIOUS IMAGES SCRAP BOOK SET,4.95
ROMANTIC IMAGES SCRAP BOOK SET,4.95
VINTAGE UNION JACK CUSHION COVER,4.95
POP'S GREASY SPOON METAL SIGN,1.65
VINTAGE GOLD TINSEL REEL,2.1
SET OF THREE 50'S GIFT WRAPS ,1.95
KITTENS DESIGN FLANNEL,0.85
S/16 VINTAGE PISTACHIO CUTLERY,12.75
CREAM SLICE FLANNEL PINK SPOT ,2.95
"FLOWER FAIRY MUG+COASTER,LAVENDER",3.75
POLYESTER FILLER PAD 45x45cm,1.55
IVORY HANGING DECORATION  HEART,0.85
VINTAGE UNION JACK CUSHION COVER,4.95
PINK HEART SHAPE PHOTO FRAME,1.65
ROBOT MUG IN DISPLAY BOX,1.25
LARGE FIBRE OPTIC CHRISTMAS TREE,2.55
PINK CHICK EGG WARMER + EGG CUP,2.1
MULTICOLOUR RABBIT EGG WARMER,2.1
PINK SPOTS CHOCOLATE NESTING BOXES ,2.95
15CM CHRISTMAS GLASS BALL 20 LIGHTS,7.95
BATHROOM SCALES RUBBER DUCKS,3.75
SET/3 RUSSIAN DOLL STACKING TINS,4.95
REX CASH+CARRY JUMBO SHOPPER,0.95
PINK UNION JACK  PASSPORT COVER ,2.1
UNION JACK FLAG PASSPORT COVER ,2.1
SET/6 GOLD REINDEER T-LIGHT CANDLES,1.95
SET/16 WHITE SHINY & MATT BAUBLES,2.1
VIPPASSPORT COVER ,2.1
TROPICAL PASSPORT COVER ,2.1
QUEEN OF THE SKIES PASSPORT COVER ,2.1
UNION JACK HOT WATER BOTTLE ,5.95
PINK UNION JACK  PASSPORT COVER ,2.1
GREEN 3 PIECE MINI DOTS CUTLERY SET,3.75
RED 3 PIECE MINI DOTS CUTLERY SET,3.75
PINK HORSE SOCK PUPPET,2.95
CHRISTMAS TOILET ROLL,1.25
PINK SPOTS CHOCOLATE NESTING BOXES ,2.95
SILVER SLEIGHBELL  WREATH,7.95
S/6 WOODEN SKITTLES IN COTTON BAG,2.95
SET/3 POT PLANT CANDLES,5.45
S/4 CACTI CANDLES,4.95
BLACK CHRISTMAS TREE 120CM,8.49
PINK AND WHITE CHRISTMAS TREE 120CM,2.95
WOODEN BOX ADVENT CALENDAR ,8.95
CERAMIC BIRDHOUSE FINCH BLUE ROOF,2.95
HEART IVORY TRELLIS SMALL,1.25
SILVER HANGING T-LIGHT HOLDER,1.45
 WHITE CHERRY LIGHTS,5.45
JUMBO BAG PINK VINTAGE PAISLEY,1.95
SET OF 72 RETRO SPOT PAPER  DOILIES,1.45
RETRO BLUE SPOTTY WASHING UP GLOVES,2.1
12 MINI TOADSTOOL PEGS,1.25
200 RED + WHITE BENDY STRAWS,1.25
WATERMELON BATH SPONGE,1.25
SANDWICH BATH SPONGE,1.25
FOLDING UMBRELLA  CHOC/WHITE  SPOT,4.95
CERAMIC STRAWBERRY TRINKET TRAY,2.55
FELT EGG COSY BLUE RABBIT ,0.85
PIZZA PLATE IN BOX,3.75
RETRO SPOT CERAMIC TOASTRACK,3.45
SET/10 PINK SPOTTY PARTY CANDLES,1.25
SET/10 BLUE SPOTTY PARTY CANDLES,1.25
FELT TOADSTOOL  SMALL,0.85
FELT TOADSTOOL LARGE,1.25
CHICK GREY HOT WATER BOTTLE,3.45
JUMBO BAG RED WHITE SPOTTY ,1.95
 3 STRIPEY MICE FELTCRAFT,1.95
CHOCOLATE CALCULATOR,1.65
S/4 GROOVY CAT MAGNETS,1.65
SANDWICH BATH SPONGE,1.25
ASSTD MULTICOLOUR CIRCLES MUG,1.69
ASSTD MULTICOLOUR CIRCLES MUG,1.69
PINK SQUARE COMPACT MIRROR,3.75
CERAMIC STRAWBERRY MONEY BOX,2.55
BOX OF 6 PEBBLE CANDLES,3.45
WHITE BEADED GARLAND STRING 20LIGHT,6.35
FULL ENGLISH BREAKFAST PLATE,3.75
"JEWELLED DECORATION,PINK",2.95
CREAM SLICE FLANNEL PINK SPOT ,2.95
SET/10 BLUE SPOTTY PARTY CANDLES,1.25
6 RIBBONS ELEGANT CHRISTMAS ,1.65
SET/5 BLUE SPOTTY LID GLASS BOWLS,2.95
PORCELAIN BUTTERFLY OIL BURNER,2.95
SOMBRERO ,1.95
RIBBON REEL SPOTS DESIGN ,1.65
PINK OWL SOFT TOY,2.95
FUNKY WASHING UP GLOVES ASSORTED,2.1
RETRO PINK SPOT WASHING UP GLOVES,2.1
FLORAL ELEPHANT SOFT TOY,4.25
VINTAGE CREAM 3 BASKET CAKE STAND,9.95
CAKE STAND LOVEBIRD 2 TIER WHITE,9.95
FAIRY CAKE CANDLES,1.49
COOK WITH WINE METAL SIGN ,1.95
GREEN GLASS TASSLE BAG CHARM,2.95
VINTAGE BEAD NOTEBOOK,2.95
BLUE OWL SOFT TOY,2.95
BEWARE OF THE CAT METAL SIGN ,1.69
CREAM SLICE FLANNEL PINK SPOT ,2.95
FUNKY MONKEY MUG,1.25
FELT TOADSTOOL LARGE,1.25
STRIPES DESIGN MONKEY DOLL,2.55
TRELLIS FLOWER CHOPSTICKS SET/5,1.95
ASSTD DESIGN POP ART SLIM PEN,0.85
6 HOOK JEWEL STAND LILAC DRESS,8.49
SILVER SLEIGHBELL  WREATH,7.95
FAIRY DREAMS INCENSE ,0.21
SET/5 BLUE SPOTTY LID GLASS BOWLS,2.95
GLITTER SNOW PEAR TREE DECORATION,1.45
KINGS CHOICE SMALL TUBE MATCHES,1.65
SET/6  ANGEL T-LIGHTS WHITE/GOLD,1.25
CERAMIC BIRDHOUSE CRESTED TIT LARGE,5.95
LADIES & GENTLEMEN METAL SIGN,2.55
LADS ONLY TISSUE BOX,1.25
SET 12 LAVENDER  BOTANICAL T-LIGHTS,2.95
4 LAVENDER BOTANICAL DINNER CANDLES,3.75
ENGLISH ROSE DESIGN SHOPPING BAG,2.55
PINK MARSHMALLOW SCARF KNITTING KIT,2.95
SKULLS  WATER TRANSFER TATTOOS ,0.85
HEART IVORY TRELLIS SMALL,1.25
HEART FILIGREE DOVE  SMALL,1.25
HEART IVORY TRELLIS LARGE,1.65
PARTY METAL SIGN ,1.45
TRADITIONAL CHRISTMAS RIBBONS,1.25
TRADITIONAL CHRISTMAS RIBBONS,1.25
RED WOOLLY HOTTIE WHITE HEART.,3.75
MUSHROOM BLUE HOT WATER BOTTLE,2.95
GREY HEART HOT WATER BOTTLE,3.45
SET OF 2 FANCY FONT TEA TOWELS,2.95
MUMMY MOUSE RED GINGHAM RIBBON,5.45
FOOD CONTAINER SET 3 LOVE HEART ,1.95
ASSORTED TUTTI FRUTTI NOTEBOOK,2.1
MOON INCENSE,0.21
CHOCOLATE CALCULATOR,1.65
GROOVY CACTUS INFLATABLE,0.85
PINK DIAMANTE PEN IN GIFT BOX,4.95
SILVER DIAMANTE PEN IN GIFT BOX,4.95
LILAC DIAMANTE PEN IN GIFT BOX,4.95
12 PENCILS SMALL TUBE SKULL,0.65
ASSORTED TUTTI FRUTTI NOTEBOOK,2.1
REX CASH+CARRY JUMBO SHOPPER,0.95
ENGLISH ROSE NOTEBOOK A6 SIZE,0.65
ENGLISH ROSE NOTEBOOK A7 SIZE,0.42
UNION JACK FLAG PASSPORT COVER ,2.1
UNION JACK FLAG LUGGAGE TAG,1.25
GIRLY PINK TOOL SET,4.95
GLITTER BUTTERFLY CLIPS,2.55
GLITTER HANGING BUTTERFLY STRING,2.1
PATCHWORK PENCIL CASE BUTTERFLY ,2.1
OPULENT VELVET SET/3 CANDLES,1.25
SHOPPING BAG DOORSTOP,1.25
PINK CURRENT CANDLE RING,0.19
FOLK ART METAL HEART T-LIGHT HOLDER,0.38
PRICE'S CANDLE PEACH,0.08
"F.FAIRY S/3 CANDLE/GLASS,LILY/VALLY",1.95
MIDNIGHT GLAMOUR SCARF KNITTING KIT,1.25
JACOBS LADDER SMALL,0.06
RETRO SPOT TEA SET CERAMIC 11 PC ,4.95
SILVER/BLACK ORBIT NECKLACE,9.95
WEEKEND BAG VINTAGE ROSE PAISLEY,8.5
RED SPOTTY CHILDS UMBRELLA,3.25
RED/WHITE DOTS RUFFLED UMBRELLA,5.95
RED GINGHAM ROSE JEWELLERY BOX,1.65
LUNCH BAG  BLACK SKULL.,1.65
LUNCH BAG WOODLAND,1.65
WHITE GOOSE FEATHER CHRISTMAS TREE ,2.95
ASSTD DESIGN BUBBLE GUM RING,0.21
SILVER TEDDY BEAR,1.25
BLACK PHOTO ALBUM ,1.95
PASTEL BLUE PHOTO ALBUM,1.95
PASTEL PINK PHOTO ALBUM,1.95
"CANDLE IN JAR COLLAGE , VANILLA",2.55
ROSE SCENT CANDLE IN JEWELLED BOX,4.25
,0
RETRO SPOT TEA SET CERAMIC 11 PC ,4.95
BAKING SET 9 PIECE RETROSPOT ,4.95
FLORAL SOFT CAR TOY,3.75
CANDY SPOT BUNNY,2.95
WOOD ANIMALS HEIGHT CHART STICKERS ,2.95
VINTAGE HEADS AND TAILS CARD GAME ,1.25
PURPLE CURRENT CANDLE RING,0.19
SET/6 3D KIT CARDS FOR KIDS,0.85
RED GINGHAM ROSE JEWELLERY BOX,1.65
RED SPOTTY CHARLOTTE BAG,0.85
SUKI  SHOULDER BAG,1.65
ASSORTED COLOUR MINI CASES,7.95
 RED/WHITE DOT MINI CASES,7.95
SET OF 3 CASES WOODLAND DESIGN,5.95
WOOD STAMP SET FLOWERS,1.65
EIGHT PIECE DINOSAUR SET,1.25
JAPANESE CROCHETED ANIMAL,0.42
LUNCHBOX WITH CUTLERY RETROSPOT ,2.55
CROCHET BEAR WITH BLUE STRIPES,2.55
36 PENCILS TUBE WOODLAND,1.25
36 PENCILS TUBE RED SPOTTY,1.25
12 PENCILS TALL TUBE RED SPOTTY,0.85
12 PENCILS TALL TUBE WOODLAND,0.85
MOBILE VINTAGE HEARTS ,4.95
HOME BUILDING BLOCK WORD,5.95
ENGLISH ROSE NOTEBOOK A6 SIZE,0.65
RED DAISY PAPER LAMPSHADE,1.25
POSTAGE,18
NOEL WOODEN BLOCK LETTERS ,5.95
12 PENCILS SMALL TUBE RED SPOTTY,0.65
36 PENCILS TUBE RED SPOTTY,1.25
12 PENCILS TALL TUBE RED SPOTTY,0.85
SMALL RED SPOT  WINDMILL,1.25
CHOCOLATE CALCULATOR,1.65
ASSORTED COLOUR BIRD ORNAMENT,1.69
HEART FILIGREE DOVE  SMALL,1.25
HEART FILIGREE DOVE LARGE,1.65
ASSORTED TUTTI FRUTTI NOTEBOOK,2.1
ASSORTED TUTTI FRUTTI KEYRING,0.85
ASSORTED TUTTI FRUTTI BRACELET,0.65
SILVER HANGING T-LIGHT HOLDER,1.65
RED HANGING HEART T-LIGHT HOLDER,2.95
VICTORIAN GLASS HANGING T-LIGHT,1.25
CAKE STAND VICTORIAN FILIGREE SMALL,4.95
CAKE STAND VICTORIAN FILIGREE MED,6.75
 RED/WHITE DOT MINI CASES,7.95
JACOBS LADDER SMALL,0.06
BEIGE PHOTO ALBUM,1.95
PASTEL PINK PHOTO ALBUM,1.95
PASTEL BLUE PHOTO ALBUM,1.95
6 HOOK JEWELLERY STAND BLACK DRESS,1.95
PINK DRESS JEWELLERY STAND ,0.85
ASSORTED COLOUR SILK COIN PURSE,0.38
ASSORTED COLOUR SILK GLASSES CASE,0.38
FELTCRAFT DOLL ROSIE,2.55
RIBBON REEL LACE DESIGN ,1.85
RIBBON REEL STRIPES DESIGN ,1.45
FELTCRAFT 6 FLOWER FRIENDS,2.1
HEART FILIGREE DOVE  SMALL,1.06
SET/5 RED SPOTTY LID GLASS BOWLS,2.55
FOLKART ZINC HEART CHRISTMAS DEC,0.72
HEART DECORATION PAINTED ZINC ,0.55
ANGEL DECORATION PAINTED ZINC ,0.55
FOOD CONTAINER SET 3 LOVE HEART ,1.65
WHITE HANGING HEART T-LIGHT HOLDER,2.55
DOVE DECORATION PAINTED ZINC ,0.55
GIANT MEDINA STAMPED METAL BOWL ,8.5
BABY MOUSE RED GINGHAM DRESS,3.75
RETRO SPOT SUGAR JAM BOWL,2.1
SET OF 3 CASES WOODLAND DESIGN,5.45
PINK  SPOTTY PLATE ,1.45
ZINC METAL HEART DECORATION,1.06
SET/20 WOODLAND PAPER NAPKINS ,0.64
FELTCRAFT DOLL MOLLY,2.55
PARTY PIZZA DISH RED WHITE SPOT ,0.85
FELTCRAFT 6 FLOWER FRIENDS,2.1
COLOUR GLASS. STAR T-LIGHT HOLDER,2.75
EDWARDIAN PARASOL RED,5.95
EDWARDIAN PARASOL NATURAL,5.95
EDWARDIAN PARASOL BLACK,5.95
SET OF 3 VINTAGE TEA TIME BOXES,1.65
WHITE CHOCOLATE SCENT CANDLE,0.65
SILVER GLITTER FLOWER VOTIVE HOLDER,0.29
CREAM SWEETHEART MAGAZINE RACK,16.95
WHITE HANGING HEART T-LIGHT HOLDER,2.95
OFFICE MUG WARMER CHOC+BLUE,4.95
OFFICE MUG WARMER BLACK+SILVER ,4.95
HOT WATER BOTTLE TEA AND SYMPATHY,3.95
PAPER CHAIN KIT EMPIRE,2.95
PIZZA SLICE DISH,1.25
FULL ENGLISH BREAKFAST PLATE,3.75
LADIES & GENTLEMEN METAL SIGN,2.55
PLEASE ONE PERSON  METAL SIGN,2.1
PAPER CHAIN KIT 50'S CHRISTMAS ,2.95
PAPER CHAIN KIT 50'S CHRISTMAS ,2.95
PAPER CHAIN KIT RETRO SPOT,2.95
PAPER CHAIN KIT EMPIRE,2.95
PAPER CHAIN KIT SKULLS ,2.95
SET/5 RED SPOTTY LID GLASS BOWLS,2.95
SET/20 RED SPOTTY PAPER NAPKINS ,0.85
SET OF 72 RETRO SPOT PAPER  DOILIES,1.45
PACK OF 72 RETRO SPOT CAKE CASES,0.55
PINK BLUE FELT CRAFT TRINKET BOX,1.25
FELTCRAFT DOLL ROSIE,2.95
FELTCRAFT DOLL MOLLY,2.95
12 PENCILS SMALL TUBE SKULL,0.65
PACK OF 72 SKULL CAKE CASES,0.55
PACK OF 20 SKULL PAPER NAPKINS,0.85
PACK OF 20 FAIRY CAKE PAPER NAPKINS,0.85
SET OF 36 TEATIME PAPER DOILIES,1.45
60 TEATIME FAIRY CAKE CASES,0.55
72 SWEETHEART FAIRY CAKE CASES,0.55
RED STRIPE CERAMIC DRAWER KNOB,1.25
BLUE STRIPE CERAMIC DRAWER KNOB,1.25
BLUE SPOT CERAMIC DRAWER KNOB,1.25
RED SPOT CERAMIC DRAWER KNOB,1.25
WHITE SPOT RED CERAMIC DRAWER KNOB,1.25
WHITE SPOT BLUE CERAMIC DRAWER KNOB,1.25
PAPER BUNTING WHITE LACE,2.95
SET/20 WOODLAND PAPER NAPKINS ,0.85
SET/20 COLLAGE PAPER NAPKIN ,0.85
PARTY CONE CHRISTMAS DECORATION ,0.85
SET OF 3 CASES WOODLAND DESIGN,5.95
STRAWBERRY CERAMIC TRINKET BOX,1.25
CERAMIC CAKE DESIGN SPOTTED MUG,1.49
FAIRY CAKE CERAMIC BUTTER DISH,2.95
BIG DOUGHNUT FRIDGE MAGNETS,0.85
TEA TIME TEA TOWELS ,2.95
CERAMIC STRWBERRY DESIGN MUG,1.49
MINI CAKE STAND  HANGING STRAWBERY,1.65
MINI CAKE STAND WITH HANGING CAKES,1.45
PACK 6 HEART/ICE-CREAM PATCHES,1.25
WOOD STAMP SET HAPPY BIRTHDAY,1.65
WOOD STAMP SET BEST WISHES,1.65
WOOD STAMP SET THANK YOU,1.65
SET3 BOOK BOX GREEN GINGHAM FLOWER ,4.25
SET/3 RED GINGHAM ROSE STORAGE BOX,3.75
CAKES AND BOWS GIFT  TAPE,0.65
SKULLS TAPE,0.65
RED AND WHITE SPOT TAPE,0.65
STARS GIFT TAPE ,0.65
ROMANTIC PINKS RIBBONS ,1.25
BABY BOOM RIBBONS ,1.25
"DOG BOWL , CHASING BALL DESIGN",3.75
CAT BOWL ,2.55
BIRD HOUSE HOT WATER BOTTLE,3.45
RED SPOT HEART HOT WATER BOTTLE,4.95
RED WHITE SCARF  HOT WATER BOTTLE,3.95
BLUE WHITE SCARF HOT WATER BOTTLE,3.95
GLITTER SNOW PEAR TREE DECORATION,1.45
RED  EGG  SPOON,0.42
BLUE EGG  SPOON,0.42
COFFEE MUG DOG + BALL DESIGN,2.55
COFFEE MUG CAT + BIRD DESIGN,2.55
COSY SLIPPER SHOES SMALL  RED ,2.95
COSY SLIPPER SHOES LARGE RED,2.95
PACK OF 72 RETRO SPOT CAKE CASES,0.55
60 TEATIME FAIRY CAKE CASES,0.55
RETRO SPOT SMALL MILK JUG,2.55
RETRO SPOT CANDLE  MEDIUM,2.1
RETRO SPOT SMALL TUBE MATCHES,1.65
"KEY FOB , SHED",0.65
"KEY FOB , BACK DOOR ",0.65
ROTATING SILVER ANGELS T-LIGHT HLDR,2.55
VICTORIAN  METAL POSTCARD SPRING,1.69
FELTCRAFT BUTTERFLY HEARTS,1.45
SET OF THREE 50'S GIFT WRAPS ,1.95
SCANDINAVIAN REDS RIBBONS,1.25
IVY HEART WREATH,6.75
VICTORIAN METAL POSTCARD CHRISTMAS,1.65
PARTY CONE CHRISTMAS DECORATION ,0.85
OPULENT VELVET SET/3 CANDLES,2.1
ANTIQUE SILVER TEA GLASS ETCHED,1.25
PORCELAIN T-LIGHT HOLDERS ASSORTED,1.25
YULETIDE IMAGES GIFT WRAP SET,2.1
VINTAGE SNAP CARDS,0.85
,0
sold as gold,0
ZINC WILLIE WINKIE  CANDLE STICK,0.85
VICTORIAN GLASS HANGING T-LIGHT,1.25
COLOUR GLASS T-LIGHT HOLDER HANGING,0.65
BLUE STONES ON WIRE FOR CANDLE,0.08
FAIRY CAKE CANDLES,1.49
S/4 FESTIVE RED DINNER CANDLES,1.25
LOVEBIRD HANGING DECORATION WHITE ,0.85
6 CROCHET STRAWBERRIES,1.25
PAINTED METAL PEARS ASSORTED,1.69
ASSORTED COLOUR BIRD ORNAMENT,1.69
SILVER FINCH DECORATION,1.25
12 MINI TOADSTOOL PEGS,1.25
SET OF 3 BIRD LIGHT PINK FEATHER ,1.25
ETCHED GLASS STAR TREE DECORATION,1.25
PINK POODLE HANGING DECORATION ,1.45
S/15 SILVER GLASS BAUBLES IN BAG,1.25
VICTORIAN METAL POSTCARD CHRISTMAS,1.65
"GARLAND, MAGIC GARDEN 1.8M",1.95
EMPIRE TISSUE BOX,1.25
,0
GREEN CHRISTMAS TREE STRING 20LIGHT,4.95
NOEL WOODEN BLOCK LETTERS ,5.95
 PEACE WOODEN BLOCK LETTERS,6.95
15CM CHRISTMAS GLASS BALL 20 LIGHTS,6.95
,0
15CM CHRISTMAS GLASS BALL 20 LIGHTS,7.95
JAPANESE CROCHETED ANIMAL,0.42
DINOSAUR KEYRINGS ASSORTED,0.21
CAMOUFLAGE LED TORCH,1.69
PINK STRIPE HOT WATER BOTTLE,2.95
RED WOOLLY HOTTIE WHITE HEART.,3.75
JUMBO BAG RED WHITE SPOTTY ,1.95
RED/WHITE DOTS RUFFLED UMBRELLA,5.95
DOOR MAT 3 SMILEY CATS,6.75
RED SPOTTY COIR DOORMAT,6.75
5 HOOK BLACKBOARD ORGANISER ,9.95
SNOWFLAKE PORTABLE TABLE LIGHT ,2.95
STAR PORTABLE TABLE LIGHT ,2.95
CREAM SLICE FLANNEL PINK SPOT ,2.95
HANGING HEART ZINC T-LIGHT HOLDER,0.85
SINGLE HEART ZINC T-LIGHT HOLDER,0.95
RIBBON REEL STRIPES DESIGN ,1.65
VICTORIAN  METAL POSTCARD SPRING,1.69
HOME BUILDING BLOCK WORD,5.95
WELCOME  WOODEN BLOCK LETTERS,9.95
FIRST AID TIN,3.25
VINTAGE KEEPSAKE BOX BEAUTY GIRL,6.35
SWALLOW GIANT TUBE MATCHES,2.1
ASSORTED COLOUR SILK COSMETIC PURSE,2.1
"BROCADE PURSE,SMALL ARCH BUTTON",0.29
ZINC METAL HEART DECORATION,1.25
ASSORTED COLOUR BIRD ORNAMENT,1.69
ZINC WILLIE WINKIE  CANDLE STICK,0.85
GLASS HEART T-LIGHT HOLDER ,0.85
GLASS BONBON JAR PARFUME AUX FLEURE,1.25
GLASS BONBON JAR. D'AMANDES,1.25
GLASS BONBON JAR. SUPERFINES,1.25
COSY HOUR CIGAR BOX MATCHES ,1.25
SWALLOW CIGAR BOX MATCHES ,1.25
RETRO SPOT  CIGAR BOX MATCHES ,1.25
KINGS CHOICE CIGAR BOX MATCHES ,1.25
36 PENCILS TUBE RED SPOTTY,1.25
36 PENCILS TUBE SKULLS,1.25
SCOTTIE DOG HOT WATER BOTTLE,4.95
RED WOOLLY HOTTIE WHITE HEART.,3.75
FAIRY CAKE CANDLES,1.49
6 EGG HOUSE PAINTED WOOD,7.95
PINK CLEAR GLASS CANDLE PLATE,1.25
LOVE HEART POCKET WARMER,1.65
SET/6 PINK  BUTTERFLY T-LIGHTS,2.1
SET/6 TURQUOISE BUTTERFLY T-LIGHTS,2.1
SET/6 PURPLE BUTTERFLY T-LIGHTS,2.1
SINGLE HEART ZINC T-LIGHT HOLDER,0.95
BUNNY WOODEN PAINTED WITH BIRD ,0.85
JIGSAW TREE WITH BIRDHOUSE,1.45
TUB 24 HANGING EASTER EGGS SPOTTY,3.75
"GARLAND , WOODEN  "" HAPPY EASTER""",1.25
HAPPY EASTER HANGING DECORATION,3.75
HEN HOUSE DECORATION,1.65
ZINC METAL HEART DECORATION,1.25
DOOR MAT FRIENDSHIP ,5.95
DOOR MAT NEW ENGLAND,5.95
"GARLAND, MAGIC GARDEN 1.8M",1.95
MOROCCAN TEA GLASS,0.85
RED STRIPE CERAMIC DRAWER KNOB,1.25
BLUE STRIPE CERAMIC DRAWER KNOB,1.25
ENVELOPE 50 ROMANTIC IMAGES,0.85
PARTY CONES CANDY TREE DECORATION,0.72
BLUE PADDED SOFT MOBILE,4.25
FAIRY CAKE PLACEMATS,3.75
SET/3 VANILLA SCENTED CANDLE IN BOX,4.25
CERAMIC STRWBERRY DESIGN MUG,1.49
SWEETHEART CERAMIC TRINKET BOX,1.25
CHOCOLATE HOT WATER BOTTLE,4.95
S/3 TEAR DROP CUT GLASS DECORATION,0.5
SET/3 RED GINGHAM ROSE STORAGE BOX,3.75
PACK OF 72 RETRO SPOT CAKE CASES,0.55
STRAWBERRY HONEYCOMB  GARLAND ,1.65
BUTTERFLIES  HONEYCOMB GARLAND,1.65
3D HEARTS  HONEYCOMB PAPER GARLAND,2.95
PINK BITTY LIGHT CHAIN,4.65
GREEN BITTY LIGHT CHAIN,4.65
STAR PORTABLE TABLE LIGHT ,2.95
WHITE BEADED GARLAND STRING 20LIGHT,6.35
72 SWEETHEART FAIRY CAKE CASES,0.55
PINK HEARTS LIGHT CHAIN ,4.65
RED HEARTS LIGHT CHAIN ,4.65
PAPER CHAIN KIT RETRO SPOT,2.95
SET/10 BLUE SPOTTY PARTY CANDLES,1.25
SET/10 IVORY SPOTTY PARTY CANDLES,1.25
SET/10 PINK SPOTTY PARTY CANDLES,1.25
SET/10 RED SPOTTY PARTY CANDLES,1.25
JUMBO BAG OWLS,1.95
JUMBO BAG TOYS ,1.95
JUMBO STORAGE BAG SUKI,1.95
MIDNIGHT GLAMOUR SCARF KNITTING KIT,2.95
FRAPPUCINO SCARF KNITTING KIT,2.95
PINK MARSHMALLOW SCARF KNITTING KIT,2.95
BUBBLE GUM SCARF KNITTING KIT,2.95
DUCK SOCK PUPPET,2.95
FROG SOCK PUPPET,2.95
PINK HORSE SOCK PUPPET,2.95
FELTCRAFT DOLL EMILY,2.95
FELTCRAFT DOLL MARIA,2.95
FELTCRAFT DOLL MOLLY,2.95
FELTCRAFT DOLL ROSIE,2.95
RED FLORAL FELTCRAFT SHOULDER BAG,3.75
GREEN FLORAL FELTCRAFT SHOULDER BAG,3.75
PINK FLORAL FELTCRAFT SHOULDER BAG,3.75
12 PENCILS SMALL TUBE SKULL,0.65
12 PENCILS TALL TUBE SKULLS,0.85
36 PENCILS TUBE RED SPOTTY,1.25
12 PENCILS TALL TUBE RED SPOTTY,0.85
12 PENCILS TALL TUBE WOODLAND,0.85
SET/3 POLKA DOT STACKING TINS,4.95
SET OF THREE VINTAGE GIFT WRAPS,1.95
SET OF 3 CASES WOODLAND DESIGN,5.95
JUMBO  BAG BAROQUE BLACK WHITE,1.95
JUMBO BAG PINK VINTAGE PAISLEY,1.95
JUMBO BAG STRAWBERRY,1.95
JUMBO BAG SCANDINAVIAN PAISLEY,1.95
JUMBO BAG RED WHITE SPOTTY ,1.95
"WALL MIRROR , RECT DIAMANTE, PINK/",7.95
PAPER CHAIN KIT EMPIRE,2.95
RETRO SPOT LAMP,9.95
SET/5 RED SPOTTY LID GLASS BOWLS,2.95
SET/5 BLUE SPOTTY LID GLASS BOWLS,2.95
SMALL HEART MEASURING SPOONS,0.85
LARGE HEART MEASURING SPOONS,1.65
FOOD CONTAINER SET 3 LOVE HEART ,1.95
APPLE BATH SPONGE,1.25
WATERMELON BATH SPONGE,1.25
STRAWBERRY BATH SPONGE ,1.25
DECORATIVE ROSE BATHROOM BOTTLE,1.25
GLASS BONBON JAR PARFUME AUX FLEURE,1.25
WHITE HANGING HEART T-LIGHT HOLDER,2.95
6 EGG HOUSE PAINTED WOOD,7.95
SET 10 LIGHTS NIGHT OWL,6.75
3 PIECE JIGSAW TOADSTOOLS,1.65
ANTIQUE SILVER TEA GLASS ETCHED,1.25
ASSORTED COLOUR T-LIGHT HOLDER,0.85
PINK CHERRY LIGHTS,6.75
 WHITE CHERRY LIGHTS,5.45
GOLD  CHERRY LIGHTS,6.75
JUMBO BAG PINK VINTAGE PAISLEY,1.95
JUMBO BAG SCANDINAVIAN PAISLEY,1.95
JUMBO BAG RED WHITE SPOTTY ,1.95
CREAM SWEETHEART LETTER RACK,5.45
CREAM SWEETHEART MINI CHEST,12.75
ASSORTED COLOUR BIRD ORNAMENT,1.69
PINK 3 PIECE MINI DOTS CUTLERY SET,3.75
BLUE 3 PIECE MINI DOTS CUTLERY SET,3.75
RED 3 PIECE MINI DOTS CUTLERY SET,3.75
LUNCH BAG  BLACK SKULL.,1.65
LUNCH BAG CARS BLUE,1.65
LUNCH BAG WOODLAND,1.65
LUNCH BAG RED SPOTTY,1.65
GREEN SPOTTY CUP,0.85
BLUE SPOTTY BOWL,1.25
BLUE  SPOTTY PLATE ,1.69
PINK  SPOTTY PLATE ,1.69
PINK  SPOTTY CUP,0.85
RED SPOTTY BOWL,1.25
SET/5 RED SPOTTY LID GLASS BOWLS,2.95
SET/2 RED SPOTTY TEA TOWELS ,2.95
PACK OF 72 SKULL CAKE CASES,0.55
PACK OF 72 RETRO SPOT CAKE CASES,0.55
STRAWBERRY CERAMIC TRINKET BOX,1.25
HEART IVORY TRELLIS LARGE,1.65
ZINC METAL HEART DECORATION,1.25
ROTATING SILVER ANGELS T-LIGHT HLDR,2.55
FELTCRAFT 6 FLOWER FRIENDS,2.1
BLACK WINE GLASS,1.45
PAPER CHAIN KIT RETRO SPOT,2.95
"WRAP, FRIENDSHIP ON GREEN",0.42
WRAP DAISY CARPET ,0.42
HEART IVORY TRELLIS SMALL,1.25
HEART IVORY TRELLIS LARGE,1.65
SET/6 PINK  BUTTERFLY T-LIGHTS,2.1
WHITE HANGING HEART T-LIGHT HOLDER,2.95
ROTATING SILVER ANGELS T-LIGHT HLDR,2.55
SQUARE FLOOR CUSHION VINTAGE PINK ,7.95
RED SPOTTY CHARLOTTE BAG,0.85
VINTAGE HEADS AND TAILS CARD GAME ,1.25
VINTAGE SNAP CARDS,0.85
ANT WHITE WIRE HEART SPIRAL,3.39
VINTAGE POST OFFICE CABINET,79.95
OPULENT VELVET CANDLE IN BOX,2.1
STRAWBERRY CERAMIC TRINKET BOX,1.25
CHRISTMAS CARD STACK OF PRESENTS,0.42
CREAM SWEETHEART DOUBLE SHELF,16.95
STRAWBERRY CERAMIC TRINKET BOX,1.25
CERAMIC BOWL WITH STRAWBERRY DESIGN,2.95
PAPER CHAIN KIT EMPIRE,2.55
PAPER CHAIN KIT 50'S CHRISTMAS ,2.55
NOEL WOODEN BLOCK LETTERS ,5.45
RED SPOTTY COIR DOORMAT,5.95
WHITE SKULL HOT WATER BOTTLE ,3.75
CHICK GREY HOT WATER BOTTLE,3.45
FAWN BLUE HOT WATER BOTTLE,2.95
KENSINGTON COFFEE SET,12.75
 RIDGED GLASS T-LIGHT HOLDER,0.55
UNION JACK GUNS & ROSES  DOORMAT,6.75
KINGS CHOICE GIANT TUBE MATCHES,2.55
DOOR MAT FAIRY CAKE,0
SMALL SILVER TRELLIS CANDLEPOT,2.95
SMALL HAMMERED SILVER CANDLEPOT ,2.95
SILVER PLATE CANDLE BOWL LARGE,3.75
SILVER PLATE CANDLE BOWL SMALL,2.95
SILVER HANGING T-LIGHT HOLDER,1.65
CAKE STAND VICTORIAN FILIGREE LARGE,8.5
CAKE STAND VICTORIAN FILIGREE MED,6.75
CAKE STAND VICTORIAN FILIGREE SMALL,4.95
VICTORIAN GLASS HANGING T-LIGHT,1.25
CERAMIC BIRDHOUSE BLACK ROSE  LARGE,5.95
CERAMIC BIRDHOUSE RED ROOF LARGE,5.95
CERAMIC BIRDHOUSE BUTTERFLY LARGE,5.95
LOVE BUILDING BLOCK WORD,5.95
HOME BUILDING BLOCK WORD,5.95
SPOTTY  HOME SWEET HOME DOORMAT,6.75
NOEL WOODEN BLOCK LETTERS ,5.95
FOLKART ZINC HEART CHRISTMAS DEC,0.85
HANGING GLASS ETCHED TEALIGHT,1.65
SINGLE HEART ZINC T-LIGHT HOLDER,0.95
VICTORIAN GLASS HANGING T-LIGHT,1.25
SET OF 3 CONEY ISLAND OVAL BOXES,4.95
S/4 VALENTINE DECOUPAGE HEART BOX,2.95
COLOURING PENCILS BROWN TUBE,0.85
75 BLACK PETIT FOUR CASES,0.42
60 GOLD AND SILVER FAIRY CAKE CASES,0.55
PACK OF 60 DINOSAUR CAKE CASES,0.55
PACK OF 72 RETRO SPOT CAKE CASES,0.55
RED GINGHAM ROSE JEWELLERY BOX,1.65
RIBBON REEL STRIPES DESIGN ,1.65
PLACE SETTING WHITE HEART,0.42
WHITE SKULL HOT WATER BOTTLE ,3.75
RED SPOTTY CHILDS APRON,1.95
CERAMIC BIRDHOUSE BLACK ROSE  LARGE,5.95
CERAMIC BIRDHOUSE BUTTERFLY LARGE,5.95
ASSTD DESIGN BUBBLE GUM RING,0.21
WHITE HANGING HEART T-LIGHT HOLDER,2.55
JUMBO BAG SCANDINAVIAN PAISLEY,1.95
"CHARLOTTE BAG , SUKI DESIGN",0.85
APPLE BATH SPONGE,1.25
WATERMELON BATH SPONGE,1.25
STRAWBERRY BATH SPONGE ,1.25
SET/4 BLUE FLOWER CANDLES IN BOWL,1.65
S/4 PINK FLOWER CANDLES IN BOWL,1.65
SET/4 PINK ORCHID CANDLES IN BOWL,1.65
ASSTD DESIGN BUBBLE GUM RING,0.21
WHITE ADVENT CANDLE,2.12
CRYSTAL STILETTO PHONE CHARM,0.85
PINK CRYSTAL HEART PHONE CHARM,0.85
CRYSTAL CZECH CROSS PHONE CHARM,0.85
CRYSTAL KEY+LOCK PHONE CHARM,0.85
PINK CRYSTAL GUITAR PHONE CHARM,0.85
FUNKY GIRLZ MAGNETIC TO DO LIST ,0.65
FUNKY GIRLZ ASST MAGNETIC MEMO PAD,0.65
ASS COL SMALL SAND GECKO P'WEIGHT,0.42
ASS COL SMALL SAND FROG P'WEIGHT,0.42
KINGS CHOICE SMALL TUBE MATCHES,1.65
RED SPOTTY SHOPPER BAG,1.25
POSY SHOPPER BAG,1.25
PARTY FOOD SHOPPER BAG,1.25
WASH BAG VINTAGE ROSE PAISLEY,2.55
JUMBO BAG OWLS,1.95
JUMBO BAG RED WHITE SPOTTY ,1.95
JUMBO STORAGE BAG SUKI,1.95
JUMBO BAG PINK VINTAGE PAISLEY,1.95
WOODEN HAPPY BIRTHDAY GARLAND,2.95
FAIRY CAKE CANDLES,1.49
GREEN 3 PIECE MINI DOTS CUTLERY SET,3.75
PINK 3 PIECE MINI DOTS CUTLERY SET,3.75
RED 3 PIECE MINI DOTS CUTLERY SET,3.75
PACK OF 72 RETRO SPOT CAKE CASES,0.55
PACK OF 60 PINK PAISLEY CAKE CASES,0.55
60 TEATIME FAIRY CAKE CASES,0.55
DOOR MAT WELCOME PUPPIES,6.75
DOOR MAT 3 SMILEY CATS,6.75
DOOR MAT NEW ENGLAND,6.75
RED SPOTTY COIR DOORMAT,6.75
PINK CHERRY LIGHTS,5.45
LIGHT PINK CHERRY LIGHTS,5.45
SCOTTIE DOG HOT WATER BOTTLE,4.25
HOME SWEET HOME MUG,1.25
CHOCOLATE HOT WATER BOTTLE,4.25
FANCY FONT HOME SWEET HOME DOORMAT,5.95
KNITTED UNION FLAG HOT WATER BOTTLE,3.39
UNION JACK HOT WATER BOTTLE ,4.95
HOT WATER BOTTLE TEA AND SYMPATHY,3.45
 HOME SWEET HOME  BLACKBOARD,6.35
OPEN CLOSED METAL SIGN,4.95
RED STRIPE CERAMIC DRAWER KNOB,1.25
RED SPOT CERAMIC DRAWER KNOB,1.25
BLUE STRIPE CERAMIC DRAWER KNOB,1.25
BLUE SPOT CERAMIC DRAWER KNOB,1.25
RED SPOTTY COIR DOORMAT,6.75
FANCY FONT HOME SWEET HOME DOORMAT,6.75
DOOR MAT BLACK FLOCK ,6.75
DOORMAT HEARTS,6.75
DOOR MAT NEW ENGLAND,6.75
HOME BUILDING BLOCK WORD,5.95
PAPER CHAIN KIT RETRO SPOT,2.95
SWALLOW GIANT TUBE MATCHES,2.55
RETRO SPOT  CIGAR BOX MATCHES ,1.25
DOOR MAT ENGLISH ROSE ,6.75
FAIRY CAKE PLACEMATS,3.75
ETCHED GLASS COASTER,1.25
SET OF 4 FAIRY CAKES COASTERS ,1.25
5 HOOK BLACKBOARD ORGANISER ,9.95
GIN + TONIC DIET METAL SIGN,2.1
